Kp2NvmUN8E,3,3574502162613686,Leese Halpen,Hodkiewicz and Sons,328-89-5366,4,951 Clarendon Way,Leese,Halpen,285-14-4496,24/04/2020,62011-0200,3,16.81,Scrophulariaceae,nisl venenatis lacinia aenean sit amet justo morbi ut
CHICGpoosU,1,630470105454241854,Linus Warde,Ankunding-Steuber,388-78-2956,4,98 Warner Drive,Linus,Warde,691-82-8167,24/04/2020,0168-0080,2,14.15,Fabaceae,ligula pellentesque ultrices phasellus id
Mxslb8o1l6,3,5108759168760008,Boote Forrestall,Weissnat-Effertz,667-26-1957,4,3299 Manufacturers Place,Boote,Forrestall,264-50-5198,26/10/2019,52533-060,2,10.34,Scrophulariaceae,quis turpis sed ante vivamus tortor duis mattis egestas
bdbHRXtVAD,4,3546942535614828,Dermot Saladin,Schuster- Murphy and Farrell,449-47-6364,3,18 Kings Point,Dermot,Saladin,249-40-4408,03/01/2020,51688-5473,1,24.79,Poaceae,eu est congue elementum in
mhCSmus9ru,1,56022300882581911,Devin Ferreras,Lynch-Kohler,715-23-5457,3,5 Dawn Circle,Devin,Ferreras,530-89-2380,05/07/2020,51079-747,5,1.26,Hydrophyllaceae,vitae nisi nam ultrices libero non mattis
bLL77pcuj2,3,5591925764640191,Dorice O'Hartagan,Friesen Inc,776-34-2348,4,9 Division Hill,Dorice,O'Hartagan,567-28-1752,08/06/2020,48951-8057,1,20.79,Poaceae,metus sapien ut nunc vestibulum ante ipsum
ooiAOoDV8F,2,3538280054227676,Rooney Demetr,Ward- Lowe and Boyer,768-90-3796,4,2520 Donald Place,Rooney,Demetr,823-38-7110,17/10/2019,0591-5239,3,8.24,Asteraceae,in purus eu magna vulputate
yiq4FSla4F,3,3574212429318968,Kamila Bettison,Pagac Inc,312-65-0931,4,68 Macpherson Place,Kamila,Bettison,747-45-0847,24/11/2019,55111-148,5,3.82,Pinaceae,luctus rutrum nulla tellus in sagittis
XkBGjGAzuY,4,6759957167920926,Florri Klauber,Schoen-Koepp,483-93-9993,3,99 Dexter Plaza,Florri,Klauber,339-93-5379,25/01/2020,55111-664,2,25.3,Acanthaceae,ipsum dolor sit amet consectetuer adipiscing elit proin risus praesent
MzG9vMES6j,3,3549744902145973,Taffy Kitching,Bogan Group,152-43-8384,4,6 Dawn Center,Taffy,Kitching,357-53-0761,10/09/2020,57896-791,5,17.44,Physciaceae,nibh quisque id justo sit amet sapien dignissim vestibulum
c9yrg7UVNU,3,3531173776717941,Sergent Reade,Pouros Group,764-63-0026,4,05 Pierstorff Park,Sergent,Reade,133-60-1089,14/07/2020,49765-410,2,5.31,Convolvulaceae,quis odio consequat varius integer ac leo pellentesque ultrices mattis
54OyGgsnuf,4,3578221692458431,Gina De Witt,Kovacek- Rogahn and O'Connell,227-89-1848,3,51 Mockingbird Terrace,Gina,De Witt,519-90-4497,06/12/2019,54868-5261,5,24.68,Clusiaceae,ut nunc vestibulum ante ipsum primis
eztw7HlKHv,1,30049410748124,Melanie Duke,Bins and Sons,829-95-9388,1,973 Eastlawn Place,Melanie,Duke,219-29-5291,17/01/2020,10888-5001,4,4.55,Pottiaceae,at nunc commodo placerat praesent blandit nam
0nxLpGv5xv,1,5100177186830570,Carline Sabathe,Bosco- Rempel and Franecki,344-37-9131,3,3 Randy Street,Carline,Sabathe,727-14-0101,01/02/2020,0395-1005,2,27.29,Brassicaceae,sed magna at nunc commodo placerat praesent
kjHUch8TSF,2,3537825647459177,Celinka Gwyther,Auer-Emmerich,851-23-0325,2,9 Bultman Parkway,Celinka,Gwyther,218-68-6039,01/07/2020,60681-2807,4,22.46,Hydrophyllaceae,vel lectus in quam fringilla rhoncus mauris
QVgZWvzQpW,4,56022229206869639,Joby Leebeter,Hansen-Bechtelar,613-45-8406,3,99065 Harper Place,Joby,Leebeter,793-39-9972,21/04/2020,66689-008,4,25.69,Asteraceae,aliquam erat volutpat in congue etiam
q8DARDhJ8b,4,5108750717676100,Carlynn Eyckelberg,Schaden- Cruickshank and Spinka,422-50-3732,4,31 Bultman Avenue,Carlynn,Eyckelberg,616-45-0103,10/04/2020,62011-0221,5,17.0,Fabaceae,bibendum imperdiet nullam orci pede venenatis non
nIpq8XwL56,4,675989422849605340,Rosco Critoph,Pollich- Johnston and Lakin,727-40-0509,4,2617 Burrows Center,Rosco,Critoph,652-55-9639,13/07/2020,54868-4176,2,6.22,Pedaliaceae,risus dapibus augue vel accumsan tellus nisi eu orci mauris
wyVScK0kDv,3,3541653576780767,Vivian Spearing,Yost and Sons,261-37-2767,4,2 Lighthouse Bay Pass,Vivian,Spearing,697-99-7152,24/12/2019,36987-1524,5,15.0,Liliaceae,consectetuer adipiscing elit proin interdum mauris
XxYHTsvh5Q,3,4017951248228,Daffi Irons,Mills Inc,259-08-1259,1,622 Springs Street,Daffi,Irons,468-86-9160,31/05/2020,55910-902,1,5.98,Asteraceae,massa quis augue luctus tincidunt nulla mollis molestie lorem quisque
cg6NdmLzfh,4,3546072167506546,Jeremy Van Hault,Stanton-Nolan,450-33-3255,3,62 Butternut Road,Jeremy,Van Hault,633-19-6696,03/10/2019,61727-310,5,10.79,Asteraceae,quam turpis adipiscing lorem vitae
ZR5yWR11ik,4,5020396880285430930,Brnaby Nixon,Reichert-Pfeffer,173-79-6530,1,422 Evergreen Street,Brnaby,Nixon,242-78-0245,16/08/2020,10481-1052,5,7.84,Anacardiaceae,diam neque vestibulum eget vulputate ut ultrices
qVw45DlpA7,3,3544761779451719,Garrik Rigney,Mertz- Boyer and Batz,146-46-4061,1,0 Towne Court,Garrik,Rigney,364-37-4109,23/04/2020,53499-5933,5,11.72,Caryophyllaceae,cras in purus eu magna vulputate
y5ac13rc9f,4,490369571015503582,Merv Pindred,Harris- Donnelly and Bednar,337-28-5364,3,6588 Pennsylvania Trail,Merv,Pindred,630-32-0713,07/03/2020,60568-001,3,18.97,Splachnaceae,non mauris morbi non lectus
JRtcUUzR9E,1,201877065213520,Stafani Marguerite,O'Kon-Altenwerth,832-88-0625,1,3 Buhler Pass,Stafani,Marguerite,593-41-8231,26/12/2019,69139-001,4,22.6,Fabaceae,vestibulum ante ipsum primis in faucibus
JqFkp56OCa,2,3543474859684156,Kerwin Jakuszewski,Abbott- Sanford and Cronin,193-94-4060,3,433 Trailsway Road,Kerwin,Jakuszewski,137-82-4994,02/09/2020,36987-2117,5,6.18,Acarosporaceae,suspendisse potenti nullam porttitor lacus at turpis donec posuere metus
GkwC7YnGGv,4,30196660169434,Roy Baroux,Brown-Quitzon,147-46-0596,1,732 Rutledge Center,Roy,Baroux,667-25-3072,18/10/2019,64980-185,1,14.98,Juncaceae,in sapien iaculis congue vivamus metus arcu adipiscing molestie
DLLjCOTvrd,1,337941871982996,Judy Obin,Carter LLC,138-31-6329,4,012 Kipling Place,Judy,Obin,828-11-2130,14/05/2020,55316-267,3,18.86,Asteraceae,at lorem integer tincidunt ante vel ipsum praesent blandit lacinia
DYLnvzGXXw,3,4936373968884405,Delcine Verdy,Tillman-Mueller,200-99-4650,1,74 Oneill Road,Delcine,Verdy,171-08-8548,28/11/2019,63868-945,4,17.99,Illiciaceae,phasellus in felis donec semper sapien a
XHtAq5Eg8T,4,676136857224406113,Claudie Connechie,Beatty- Marquardt and Wunsch,498-40-4106,2,20 Esch Alley,Claudie,Connechie,317-36-0234,13/06/2020,49288-0929,2,2.45,Nyctaginaceae,aliquet maecenas leo odio condimentum id luctus nec molestie
RQk22FsyFg,3,5100132833466203,Kaile Oldroyd,Larson Group,115-16-9251,2,5 Drewry Avenue,Kaile,Oldroyd,638-77-2455,12/07/2020,63187-062,3,19.28,Oleaceae,amet lobortis sapien sapien non mi integer ac neque duis
ZtYA0hJwEH,4,201615767203435,Ursuline Pharrow,O'Reilly LLC,450-64-1830,1,7 Thierer Circle,Ursuline,Pharrow,322-83-2416,19/07/2020,54973-3188,1,27.79,Rosaceae,nunc donec quis orci eget orci vehicula condimentum curabitur in
AR9dXEyZ1X,1,5598940646823165,Lambert Crannach,Donnelly-Collins,114-29-2242,2,71 Eliot Pass,Lambert,Crannach,762-23-8152,05/10/2019,0228-3508,3,12.78,Asteraceae,turpis sed ante vivamus tortor duis mattis egestas metus aenean
MHEKBBt9Yv,4,6767680818728924,Jacklin Newtown,Ondricka-Heidenreich,381-99-1664,2,111 Maywood Center,Jacklin,Newtown,712-19-6949,14/07/2020,55910-078,2,27.61,Parmeliaceae,quis turpis sed ante vivamus tortor
BK6uKgXy6q,2,5002350608747388,Katharina Giordano,Crooks- Renner and Batz,148-95-7308,3,3248 Utah Parkway,Katharina,Giordano,542-28-7795,13/06/2020,0363-4010,2,12.41,Fabaceae,massa donec dapibus duis at
owYL9nxEVT,2,5108751220662819,Adelind Duggon,Zboncak- Emmerich and Tremblay,225-46-1380,3,551 Butterfield Court,Adelind,Duggon,850-96-7337,15/11/2019,11822-0543,2,19.68,Viscaceae,justo maecenas rhoncus aliquam lacus morbi
i4RDoA8WMm,3,3529333432694363,Kristine King,Altenwerth-Upton,500-13-4302,1,7154 Park Meadow Alley,Kristine,King,306-37-6682,20/11/2019,43846-0023,2,19.99,Encalyptaceae,ultrices enim lorem ipsum dolor sit
aP5KthvyvZ,1,3579251571966104,Heidie Endicott,Kautzer-Langosh,817-74-4931,1,1 Saint Paul Hill,Heidie,Endicott,653-20-8552,16/02/2020,63148-252,5,27.77,Polygonaceae,sem sed sagittis nam congue risus semper porta volutpat quam
9D4ic31UDl,1,3563405853498057,Paula Towler,MacGyver Group,819-25-5104,3,99 Westridge Avenue,Paula,Towler,250-86-1836,07/09/2020,47682-578,5,29.17,Linaceae,felis fusce posuere felis sed lacus morbi sem mauris laoreet
eGN42ZfG6Y,1,6771614248710156,Sauncho Songest,Howe- Gutmann and Boyle,706-27-8894,3,9394 Summit Parkway,Sauncho,Songest,194-58-5138,17/04/2020,24477-324,2,7.0,Fabaceae,eleifend quam a odio in hac habitasse platea dictumst
3PAq1go2PG,1,5602226414645442,Giorgia Bilson,Herman and Sons,469-71-0798,3,74664 Rieder Road,Giorgia,Bilson,242-07-6840,28/08/2020,57520-0140,3,16.95,Liliaceae,a odio in hac habitasse platea
hjIqrp3PDI,4,3566616814784321,Nap Crinage,Oberbrunner- Hills and Monahan,487-33-5126,1,46401 Buena Vista Park,Nap,Crinage,235-05-5358,09/03/2020,0781-4060,3,1.46,Polygonaceae,in purus eu magna vulputate luctus cum sociis natoque
AFRSBroCWK,4,5217013348293243,Prent Donwell,Buckridge-Kulas,524-37-0421,4,3941 Darwin Road,Prent,Donwell,557-05-8446,20/10/2019,49349-542,4,12.98,Hypnaceae,porta volutpat erat quisque erat eros viverra
5EbRYL7uq3,3,6331101917428560,Therese Castillou,Hagenes Group,240-01-4714,2,7 La Follette Pass,Therese,Castillou,705-92-2921,03/08/2020,37808-961,2,26.19,Hydrophyllaceae,sapien arcu sed augue aliquam erat volutpat in congue
lIpsAiNzok,2,3574822873933243,Odelinda Peetermann,Langworth Group,106-23-0474,2,94 Kenwood Trail,Odelinda,Peetermann,679-21-5208,07/09/2020,11523-7337,3,4.0,Simaroubaceae,proin interdum mauris non ligula pellentesque ultrices phasellus
LkoKaVjHOi,3,6397418853608125,Darsey Sebire,Ebert- Douglas and Greenfelder,238-12-1987,1,6 Victoria Avenue,Darsey,Sebire,263-97-0758,29/05/2020,16590-214,1,25.51,Brassicaceae,sagittis dui vel nisl duis ac
8E0JtHhXEq,2,5602227240818005,Karney Borley,Quigley and Sons,506-33-3491,4,36 Scofield Park,Karney,Borley,677-06-9362,28/06/2020,48951-8144,4,2.28,Seligeriaceae,consequat ut nulla sed accumsan
O0Vp6bmaa0,2,3576632321342063,Aleksandr Rampage,Koepp- Boyle and Cummings,580-64-8392,4,9 Claremont Junction,Aleksandr,Rampage,539-24-9158,09/07/2020,36800-271,3,28.97,Onagraceae,consectetuer adipiscing elit proin interdum mauris non ligula pellentesque
OM2aXolGNX,2,201765422760194,Moselle Blagden,Harvey-Dibbert,369-01-6612,1,552 Garrison Park,Moselle,Blagden,872-58-3716,20/05/2020,60429-540,1,15.9,Asteraceae,gravida nisi at nibh in
huYTOCJvFy,1,5602218362828490052,Ruby Farnfield,Erdman- Torphy and Little,823-78-3243,1,816 Dawn Parkway,Ruby,Farnfield,125-52-6716,19/06/2020,0037-2250,2,19.14,Rosaceae,vivamus in felis eu sapien
jgjv9DDYKW,4,3587746799191559,Saxe Size,Strosin- Altenwerth and Murazik,558-49-2105,4,45 Gerald Crossing,Saxe,Size,164-99-1163,08/10/2019,11523-7234,2,27.67,Asteraceae,nullam orci pede venenatis non sodales sed tincidunt eu felis
jWy7BErJy5,2,3543330159883213,Erik O' Mullane,Hills-Armstrong,569-60-0365,1,92 Old Shore Pass,Erik,O' Mullane,500-15-9065,16/01/2020,63629-1339,2,8.43,Scrophulariaceae,mauris vulputate elementum nullam varius nulla facilisi cras non
mPLMAfHdSK,4,3580584926756987,Dulcia Fearnyough,Rolfson-Mayer,270-80-1516,3,755 Shelley Park,Dulcia,Fearnyough,201-64-8099,01/07/2020,64679-217,2,7.94,Solanaceae,non pretium quis lectus suspendisse potenti in eleifend
EbduWcMXxr,3,675949837773934771,Halli Nelsen,Kshlerin- Lebsack and Dach,888-19-6928,3,3585 Stang Plaza,Halli,Nelsen,393-80-3196,21/09/2019,66521-115,1,13.76,Euphorbiaceae,venenatis turpis enim blandit mi in porttitor pede justo eu
ODajIw9h8H,3,3570773294831553,Angele Vanne,Hane-Gerlach,589-46-3508,2,78 Mesta Park,Angele,Vanne,776-02-6788,28/10/2019,16590-644,2,18.3,Asteraceae,quam turpis adipiscing lorem vitae mattis nibh ligula
HWN2GPykD3,3,5007663665264518,Linus Dewing,Considine- Franecki and Bogan,587-40-0539,2,36481 Gina Crossing,Linus,Dewing,660-12-7844,19/04/2020,54868-5523,2,8.97,Brassicaceae,porttitor pede justo eu massa
Dq7EdgESqZ,4,5020236067677762518,Zonnya Jiruca,Nicolas-Harber,423-89-1825,2,325 Mendota Road,Zonnya,Jiruca,758-82-2304,03/02/2020,0268-0891,4,9.52,Fabaceae,augue a suscipit nulla elit
m7tzOIA44e,4,3562968550440228,Gibb Leupold,Dach- Waters and Gusikowski,105-24-7409,4,0480 Hintze Alley,Gibb,Leupold,786-17-6494,17/04/2020,68428-015,5,23.17,Fabaceae,at nunc commodo placerat praesent blandit nam nulla
Z86kO6oi8B,4,6399395940456791,Doreen Gribbon,Greenfelder- Osinski and Schuppe,422-17-1896,2,7121 Meadow Ridge Park,Doreen,Gribbon,820-67-9274,22/04/2020,68428-052,3,11.85,Orchidaceae,nulla suspendisse potenti cras in purus eu magna
EQDAfXD51o,1,374283136116357,Sherwynd Jerisch,Dickinson- Cartwright and Hudson,175-10-1370,2,2665 Beilfuss Parkway,Sherwynd,Jerisch,181-17-2426,11/12/2019,0135-0469,2,12.6,Bryaceae,pretium nisl ut volutpat sapien arcu sed augue aliquam erat
BrBv4zTSSF,4,3552639992266123,Ephraim Tumilty,Stiedemann- Buckridge and Rohan,689-46-1375,3,2238 Forest Run Crossing,Ephraim,Tumilty,223-81-9532,26/02/2020,65862-290,5,22.49,Poaceae,erat vestibulum sed magna at nunc
CUpRUqbAXQ,2,677106868833528381,Lilah Dumbreck,Kessler- Kautzer and Donnelly,297-60-4590,3,8 Burrows Road,Lilah,Dumbreck,641-20-1442,23/01/2020,49643-122,5,2.69,Dryopteridaceae,feugiat non pretium quis lectus suspendisse potenti
wEZVLlxoIY,3,5100131408225499,Rockwell Skarman,Howe Group,871-36-1634,2,957 Hoard Place,Rockwell,Skarman,621-45-8507,21/07/2020,10191-1941,1,29.5,Brassicaceae,non sodales sed tincidunt eu felis fusce posuere felis sed
XR7zsXp9s7,4,374283139666457,Carolee Austick,Miller- Jacobs and Marks,514-19-7484,4,8 Northport Drive,Carolee,Austick,723-49-0181,10/02/2020,11822-0291,1,22.43,Fabaceae,vestibulum eget vulputate ut ultrices
TtNjFeZ71u,3,3580752162763963,Cal Goggan,Keebler- Kuphal and Predovic,555-42-5887,1,7 Loftsgordon Point,Cal,Goggan,477-18-6860,30/03/2020,42367-203,4,17.14,Cyperaceae,vestibulum vestibulum ante ipsum primis in faucibus
VAGMtpSv0U,3,5602251040885113,Myra Hucks,Rippin- Toy and Armstrong,661-11-5416,1,4400 Forest Run Point,Myra,Hucks,678-45-0321,13/06/2020,45737-246,4,21.46,Gentianaceae,dolor vel est donec odio justo sollicitudin
Ac9XhOYjHx,3,30162711863607,Sherri Extil,Cronin Group,483-34-3269,3,12816 Scoville Avenue,Sherri,Extil,182-76-4532,25/08/2020,52125-245,2,1.3,Asteraceae,at velit vivamus vel nulla
jHdTFeaVXr,4,3579778679324976,Barny Coppock.,Goyette- Grant and Reichel,559-91-2142,3,273 Anderson Pass,Barny,Coppock.,276-34-7067,27/08/2020,54868-5313,5,11.87,Letrouitiaceae,magna at nunc commodo placerat praesent
XRdRfeL8Dx,1,060440088098689745,Scarlet Prisk,Schinner- Ullrich and Pagac,609-05-2860,1,37924 Moose Place,Scarlet,Prisk,638-54-5016,16/06/2020,0555-9025,5,26.45,Asteraceae,sapien dignissim vestibulum vestibulum ante ipsum primis in faucibus orci
8BLBUdf3LN,1,5002352145241453,Emlynne MacParlan,Bradtke- Kilback and Klocko,663-33-2700,1,05 Golf View Crossing,Emlynne,MacParlan,413-39-3735,22/04/2020,0093-7167,5,7.99,Violaceae,magnis dis parturient montes nascetur ridiculus mus vivamus
kOT033I0h8,3,30420826166138,Herbie Godfree,Kunze-Farrell,110-23-3308,3,93 Hayes Center,Herbie,Godfree,506-48-5414,23/05/2020,12823-400,5,25.87,Gesneriaceae,accumsan tellus nisi eu orci mauris lacinia sapien
mov4qm65Tj,4,3540707195735221,Cornelle Rivard,Bailey-Bahringer,423-98-3605,1,5506 Thackeray Road,Cornelle,Rivard,777-48-7461,29/04/2020,0093-7455,1,15.29,Asteraceae,lectus vestibulum quam sapien varius
XbGynqtNsU,2,5602242145989058,Shannon Chastenet,Haley Group,127-90-8866,2,29192 Montana Center,Shannon,Chastenet,378-46-1485,09/07/2020,43063-210,2,10.42,Ericaceae,accumsan odio curabitur convallis duis consequat dui nec
u9FNDu83EA,1,3559393385127483,Bellina Oret,Gleichner Inc,168-20-0039,1,1941 Northland Place,Bellina,Oret,282-57-5919,17/10/2019,59667-0003,2,20.19,Brassicaceae,adipiscing lorem vitae mattis nibh ligula nec sem duis aliquam
sZs8peOYDw,4,3538950922480026,Oswald Kytley,Rolfson- Maggio and Flatley,833-38-9289,2,7 Portage Hill,Oswald,Kytley,440-35-5540,13/09/2020,54575-109,3,28.78,Ericaceae,sed magna at nunc commodo placerat praesent blandit nam nulla
6DsJ1bmoLT,1,3552296982245912,Donavon Sawer,Metz LLC,264-51-7226,3,68 Stephen Crossing,Donavon,Sawer,688-09-9798,23/07/2020,13537-531,5,22.53,Campanulaceae,nunc proin at turpis a pede posuere
MWJqnrVIgJ,2,3544012500733409,Claire Fountain,Dicki- Douglas and McGlynn,819-51-8878,2,7508 Dottie Park,Claire,Fountain,869-91-0467,19/11/2019,31586-2683,3,21.57,Fabaceae,urna pretium nisl ut volutpat sapien arcu
6Vt2c3bt9O,1,4508631504216111,Brandy Zaniolo,Miller-Stoltenberg,477-41-7117,4,959 Dunning Circle,Brandy,Zaniolo,114-01-5391,10/12/2019,37808-720,3,28.08,Scrophulariaceae,sed vestibulum sit amet cursus id turpis
1ye1kqrHCq,4,3578568406265530,Bell McDonough,Monahan and Sons,629-79-5403,1,80633 Bluejay Center,Bell,McDonough,375-25-1903,04/06/2020,63972-007,2,29.58,Pyrenulaceae,lorem id ligula suspendisse ornare consequat lectus in est risus
4vsKsRhz8n,1,3542520942117967,Hetti Darree,Pacocha-Morar,297-69-0222,2,781 Hovde Lane,Hetti,Darree,553-11-0293,11/12/2019,62713-940,3,11.31,Violaceae,leo pellentesque ultrices mattis odio donec
WJdOgnWDKY,1,3557882918012917,Sharlene Ikin,McDermott and Sons,242-78-1568,4,624 Oak Valley Street,Sharlene,Ikin,301-47-2480,16/06/2020,43857-0210,5,13.46,Juglandaceae,dictumst aliquam augue quam sollicitudin
H3zzffn35s,4,374288890928939,Gerrie Harrower,Wehner- Hammes and Gaylord,725-57-0270,4,2130 Ryan Crossing,Gerrie,Harrower,314-10-3226,16/10/2019,43269-660,3,15.97,Brassicaceae,felis fusce posuere felis sed lacus morbi sem
pd6fNoZ1rm,3,374288190555689,Romain Andre,Zulauf- Osinski and Lockman,630-17-7246,3,69 Eliot Crossing,Romain,Andre,628-78-4829,04/07/2020,54575-944,4,29.47,Verbenaceae,sagittis nam congue risus semper porta volutpat quam pede
Pr9kf6Vo3N,4,374283653396150,Allayne Lockyear,Welch- Stoltenberg and Brekke,163-68-3197,2,9 Old Gate Point,Allayne,Lockyear,108-90-0912,02/08/2020,53345-026,1,20.01,Campanulaceae,aliquet massa id lobortis convallis
muBetN5Fh2,4,374283833086275,Claresta Britch,Schaden-Kunde,605-88-0175,2,68 Eggendart Junction,Claresta,Britch,293-66-8671,15/02/2020,50563-153,3,10.25,Plantaginaceae,ultrices posuere cubilia curae mauris viverra diam vitae quam suspendisse
JbLizp5sOt,4,5602235036049081,Ramonda Winmill,Schaefer Group,695-45-5356,4,2220 Dunning Lane,Ramonda,Winmill,715-33-7522,22/03/2020,55154-4754,5,27.01,Vittariaceae,molestie sed justo pellentesque viverra pede
11qUVqHEeR,1,3573009677950083,Boy Leall,Dietrich LLC,761-75-9671,2,6 Prentice Junction,Boy,Leall,886-74-4930,26/03/2020,0093-5105,2,19.67,Amaranthaceae,in felis eu sapien cursus
s2FmRKRp4y,2,201405862158860,Lance Dunn,Brakus- Smitham and Bruen,543-85-5318,2,5669 Nancy Court,Lance,Dunn,878-79-1190,11/10/2019,63629-3976,4,15.42,Primulaceae,ante ipsum primis in faucibus
okRmz4jkWl,1,4913543992498193,Terri Pearcehouse,Glover- Kuhn and Crona,411-16-0178,3,72 Sutherland Court,Terri,Pearcehouse,281-49-3513,16/09/2020,67386-111,1,5.4,Cyperaceae,libero convallis eget eleifend luctus ultricies eu
ZjusT9So3X,1,3535191848189382,Saundra Hiers,Beer- Kemmer and Hegmann,472-89-5247,3,13 Summer Ridge Alley,Saundra,Hiers,283-24-5994,03/12/2019,51596-008,4,8.69,Loasaceae,enim lorem ipsum dolor sit amet consectetuer adipiscing elit proin
vpcp2NOSF2,3,3574774399752864,Catharina Gratrex,Schowalter-Hills,100-21-3700,1,9 Vidon Court,Catharina,Gratrex,842-40-6012,01/09/2020,65841-638,4,9.63,Myrtaceae,nisi eu orci mauris lacinia
nAZxUgwg8K,1,3557205739574255,Sebastien Gertz,Langworth- Ryan and Nicolas,421-71-7074,2,19598 Fallview Pass,Sebastien,Gertz,862-24-1555,03/07/2020,0085-1425,4,7.12,Umbilicariaceae,pellentesque ultrices phasellus id sapien in sapien
kpuK3s8VHo,3,30471421851749,Othello Roony,Ullrich-Gorczany,575-29-4397,4,0033 Shasta Court,Othello,Roony,725-06-1029,12/12/2019,36987-3105,3,4.66,Buddlejaceae,vestibulum ante ipsum primis in faucibus orci luctus
BTL9BTrcix,3,3530904363101649,Bone Wallworth,MacGyver and Sons,341-03-2833,3,78005 Del Sol Park,Bone,Wallworth,296-04-9781,10/05/2020,36987-2462,4,3.44,Asteraceae,mi pede malesuada in imperdiet et commodo vulputate
lPuI3fzfjn,2,4041372736580438,Trenna Baudi,Little- Bogisich and Barton,439-17-7961,3,47 Duke Center,Trenna,Baudi,539-30-7630,14/08/2020,68382-500,3,25.79,Arecaceae,eleifend quam a odio in hac habitasse platea dictumst maecenas
YAOHz7XoHj,3,3582503488120935,Goldarina Prosek,Sporer- McGlynn and Waters,219-71-4510,3,021 Myrtle Trail,Goldarina,Prosek,184-44-2578,25/06/2020,35356-673,5,3.39,Orobanchaceae,ultricies eu nibh quisque id justo sit amet sapien
QTkgZGFEpU,2,4903894218073209890,Karlens Hamper,Ebert-Jacobi,524-65-1470,4,92 Dakota Way,Karlens,Hamper,282-28-4333,08/10/2019,0409-1212,5,26.07,Rutaceae,posuere cubilia curae donec pharetra magna
8dfehdshAG,3,4041597902070166,Coralie Goch,Brown and Sons,462-27-5573,2,5 Arizona Junction,Coralie,Goch,548-29-1435,04/11/2019,59148-070,1,20.88,Alismataceae,metus arcu adipiscing molestie hendrerit at vulputate
9gHIpa5L9J,2,374288092581551,Itch Mussen,Volkman- Beatty and Klocko,283-58-7284,1,67575 Truax Circle,Itch,Mussen,205-89-9834,12/11/2019,57664-377,1,10.34,Myrtaceae,mattis odio donec vitae nisi
MzRqYE3UK3,3,5610782860337876,Geraldine Yeoland,Roberts- Osinski and Harris,169-97-0735,2,873 Hauk Parkway,Geraldine,Yeoland,870-84-6155,29/11/2019,0363-2529,4,27.08,Cornaceae,donec semper sapien a libero nam dui proin leo
16oOpqcPSi,3,5602229673116204,Ludvig Casbourne,Walsh- Rippin and Metz,248-13-5484,1,79922 Golf Court,Ludvig,Casbourne,844-77-6374,15/06/2020,36987-2845,1,12.1,Scrophulariaceae,natoque penatibus et magnis dis parturient montes
fmCqmgfbYK,1,50208265058777420,Alissa Hapke,Terry Group,609-52-5719,1,35224 Tennyson Point,Alissa,Hapke,184-35-8298,24/10/2019,0409-0802,4,6.13,Rosaceae,nisi venenatis tristique fusce congue diam id
3EyMjrAf1i,3,3531464477392526,Danell Cakes,Kunde Group,640-09-2379,4,7716 Aberg Center,Danell,Cakes,744-39-2777,29/10/2019,60760-124,4,16.7,Plantaginaceae,praesent lectus vestibulum quam sapien varius ut
w2L82l8vPg,1,3552311615162119,Grantham Binestead,Turner- Graham and Gibson,807-88-2852,2,4396 Summit Plaza,Grantham,Binestead,120-64-2622,18/06/2020,59630-913,4,11.29,Caprifoliaceae,hendrerit at vulputate vitae nisl aenean lectus pellentesque eget nunc
xOvEGyyHlJ,1,201965396839731,Lamond Edgin,Olson-Schoen,622-44-8675,1,51174 Spenser Alley,Lamond,Edgin,210-66-8385,21/09/2019,11410-012,2,9.59,Agavaceae,id sapien in sapien iaculis congue
isGd9LFjOc,4,560221502518364345,Euell Kenninghan,Jenkins-Dickinson,229-12-0278,4,5092 Norway Maple Junction,Euell,Kenninghan,165-27-1316,14/11/2019,0179-8705,3,27.0,Brassicaceae,nulla neque libero convallis eget eleifend luctus ultricies eu nibh
QU5ik306y9,4,5100133407655965,Emery Raulston,Kihn- Gleason and Schmitt,629-59-5427,4,9470 Donald Terrace,Emery,Raulston,385-35-1977,08/06/2020,0603-1330,4,22.66,Liliaceae,quis odio consequat varius integer ac leo pellentesque ultrices
eVoEwqXJIT,4,201695527275816,Rodney Drains,Hahn-Mann,651-76-8738,3,0742 Fallview Avenue,Rodney,Drains,636-78-2062,16/10/2019,60505-3759,4,11.71,Fabaceae,consequat metus sapien ut nunc vestibulum
0UEHIASHaE,3,374288269651187,Guenevere Lubomirski,Nicolas-Skiles,721-34-7617,3,75780 Birchwood Drive,Guenevere,Lubomirski,723-89-7473,16/06/2020,0517-0301,5,25.89,Solanaceae,massa volutpat convallis morbi odio odio elementum eu interdum
OcKpbHIXyq,3,3560363909704783,Tobi Camillo,Toy- Weber and Yundt,502-47-9517,2,8 Elka Crossing,Tobi,Camillo,889-06-4335,23/09/2019,63304-793,4,20.89,Ephedraceae,euismod scelerisque quam turpis adipiscing lorem vitae
vuLTOjb0Ex,2,3575069862649831,Colline Isaksen,Leffler and Sons,884-71-9685,2,64 2nd Way,Colline,Isaksen,782-13-5289,19/04/2020,0942-6477,4,18.05,Polygonaceae,duis consequat dui nec nisi volutpat eleifend donec ut
tLdVtayaK7,3,3579028622070429,Wilton Welfare,Weissnat- Leuschke and Crona,720-76-5500,3,25 Pine View Trail,Wilton,Welfare,777-46-4605,28/06/2020,58988-0031,2,17.63,Polygonaceae,vestibulum sit amet cursus id turpis integer aliquet massa id
NVeS3YxdTC,3,560221207113139817,Lamar Pentycost,Jacobs and Sons,446-80-0936,2,686 Park Meadow Circle,Lamar,Pentycost,768-97-0384,25/07/2020,0268-0892,2,7.72,Ericaceae,sed vestibulum sit amet cursus id turpis integer aliquet
Vvb6U9BHGF,3,58937551239440397,Brook Liebermann,Terry and Sons,869-52-4249,4,4 Shoshone Circle,Brook,Liebermann,350-29-5282,14/07/2020,0832-1120,5,28.01,Rosaceae,morbi porttitor lorem id ligula suspendisse ornare consequat
5w1cjffwVv,2,201703791339332,Griffie Gravatt,Corwin LLC,134-07-8283,3,83227 Corscot Hill,Griffie,Gravatt,404-09-7099,25/02/2020,63629-3301,2,1.02,Aceraceae,cras pellentesque volutpat dui maecenas tristique est et tempus
u3NhaK5wCm,4,630472531566180961,Starlin Daniele,Corkery- Stark and Schoen,702-07-9561,4,3 Forest Run Trail,Starlin,Daniele,857-21-4683,29/10/2019,42291-600,3,19.77,Fagaceae,quis augue luctus tincidunt nulla mollis
VQC803rB9J,1,3573853809330510,Lizzie Farnall,Kub and Sons,479-90-9275,1,223 Mcbride Place,Lizzie,Farnall,527-18-3676,02/03/2020,36987-3022,3,18.08,Asteraceae,scelerisque mauris sit amet eros suspendisse accumsan tortor quis turpis
Wzg8tMlros,2,3570052010965924,Stefania Webland,Huel Inc,334-18-1857,3,6678 Luster Way,Stefania,Webland,777-65-3154,01/08/2020,0781-5173,1,4.18,Hydrangeaceae,nisi nam ultrices libero non mattis pulvinar nulla
CHKCgL7nfR,4,3589963054135415,Hildegaard Trower,Robel-Bosco,574-27-2104,2,9 La Follette Pass,Hildegaard,Trower,521-54-7391,15/02/2020,16590-385,5,18.23,Lecideaceae,ac nulla sed vel enim sit
ojAXyhhBVd,4,3544799902154636,Lida Newark,Bergnaum-Bins,807-13-0952,4,25474 Monica Trail,Lida,Newark,334-72-7110,13/10/2019,55301-369,4,6.39,Lecideaceae,dolor sit amet consectetuer adipiscing
rziXnM9kOS,1,5414954422164357,Kristoffer Muncie,Rutherford- Moen and Lehner,714-63-9380,3,2 Mallory Junction,Kristoffer,Muncie,536-98-3799,02/05/2020,0615-7538,1,18.06,Parmeliaceae,volutpat erat quisque erat eros
