UwelEVZWTL,3,5010126713536647,Dedie Elvy,Bashirian Inc,498-18-9210,4,2 Stang Avenue,Dedie,Elvy,610-19-3335,22/11/2019,54569-5305,3,15.41,Asteraceae,lobortis est phasellus sit amet erat nulla tempus vivamus in
A1KUgSHG53,3,30010940526166,Sharity McGurn,Hessel-DuBuque,812-99-1155,4,318 Butternut Trail,Sharity,McGurn,218-13-5909,19/12/2019,11410-003,4,15.07,Osmundaceae,auctor gravida sem praesent id massa id nisl
egWpSrrEK5,1,3533147428973506,Marena Rothwell,Morar and Sons,162-95-1427,2,2140 Carpenter Terrace,Marena,Rothwell,602-22-2558,07/10/2019,0268-1305,5,28.8,Apiaceae,ut erat id mauris vulputate
U07wAE31j6,1,3589003426154859,Bartlett Kalinke,Rau and Sons,738-92-3269,4,335 Oak Valley Drive,Bartlett,Kalinke,252-68-4454,02/05/2020,0555-0869,2,16.76,Piperaceae,vestibulum sed magna at nunc commodo placerat
EZcvW7aSot,3,5020052904417051441,Jourdan Wyleman,Williamson- Bogan and Koepp,644-77-5570,3,96 Delladonna Parkway,Jourdan,Wyleman,799-14-2417,08/10/2019,48951-3053,1,26.6,Pertusariaceae,diam neque vestibulum eget vulputate ut ultrices vel augue vestibulum
1TDNUokWr1,4,5557275330028998,Fancie Bartol,Aufderhar- Friesen and Moore,884-70-3755,4,68672 Fair Oaks Lane,Fancie,Bartol,596-22-4841,27/01/2020,36800-368,5,29.16,Cyperaceae,suspendisse potenti nullam porttitor lacus at turpis
QCJ57bWFFs,2,5100170013907588,Laurene Bloggett,Mertz- Goyette and Dach,323-20-9524,2,86869 Judy Center,Laurene,Bloggett,234-07-6302,19/01/2020,51514-0318,5,3.46,Malvaceae,est lacinia nisi venenatis tristique fusce
ykhmUd26Vn,3,5100172589983456,Carlin Kaes,Morar-Heathcote,665-64-1005,2,61 Pankratz Way,Carlin,Kaes,167-36-5570,25/03/2020,59535-6501,1,13.8,Amaranthaceae,vitae ipsum aliquam non mauris morbi
Nndc08LN9m,4,5118902261669696,Lusa Forcade,Emard- Will and Ward,586-51-4717,4,32 Anzinger Trail,Lusa,Forcade,188-16-9552,10/06/2020,64117-596,5,2.11,Apiaceae,ut blandit non interdum in ante vestibulum
t8Lj9pKW1W,2,3545476534124332,Jodie Fontes,Heller- Franecki and Boyle,105-58-2315,4,34 Paget Crossing,Jodie,Fontes,350-08-7123,04/05/2020,63094-0801,2,19.36,Umbilicariaceae,ultrices posuere cubilia curae duis faucibus accumsan odio curabitur convallis
JbH2YbNpZ5,2,3582233516270326,Burg Clulow,Kirlin-Cummerata,453-37-0182,3,63 1st Drive,Burg,Clulow,810-37-7122,23/11/2019,37205-328,1,29.37,Aceraceae,nulla suscipit ligula in lacus curabitur at
yBUCQfNMqN,3,4913888861045009,Tybalt Fawdrie,Powlowski-Eichmann,680-59-3685,4,978 Fieldstone Alley,Tybalt,Fawdrie,380-05-7720,28/01/2020,41163-124,5,20.49,Cladoniaceae,justo sit amet sapien dignissim vestibulum vestibulum
oLDBPuWIMy,1,4913929833090887,Nicki Rudeyeard,White and Sons,527-16-7415,2,7 Graedel Center,Nicki,Rudeyeard,878-86-7698,15/05/2020,66116-447,5,20.04,Asteraceae,non velit donec diam neque
FmZcRjh9Tt,4,5602213826412991,Immanuel Kinane,Moore- Nienow and Lebsack,423-26-5127,4,301 Magdeline Center,Immanuel,Kinane,142-82-3062,04/03/2020,0085-3320,3,18.43,Rutaceae,fringilla rhoncus mauris enim leo
7Fmi6OS5Ig,3,633110951915988132,Raquel Hamlet,Lubowitz and Sons,577-86-3495,4,25 Larry Road,Raquel,Hamlet,843-14-6603,04/11/2019,35356-298,5,12.39,Rutaceae,at feugiat non pretium quis lectus suspendisse potenti
Jlivm49wD9,4,346160620060249,Viva Snoad,Dicki-Kilback,177-31-6538,3,783 Haas Place,Viva,Snoad,251-47-3006,04/10/2019,49349-289,5,19.68,Cyperaceae,rhoncus dui vel sem sed sagittis nam
yYLgDfjp7C,2,3578140509399796,Adolphus Rockliffe,Greenholt- Wilkinson and Fritsch,163-23-9131,1,3720 Mccormick Center,Adolphus,Rockliffe,719-27-8066,23/02/2020,61957-1020,1,11.13,Dennstaedtiaceae,pretium iaculis justo in hac habitasse platea dictumst etiam
WAPZJ8MZdN,3,374288671250610,Bailie Frowing,Runte-Gottlieb,750-81-1016,2,135 Cody Street,Bailie,Frowing,783-80-7461,27/03/2020,10544-227,5,8.08,Malvaceae,justo nec condimentum neque sapien placerat ante nulla justo aliquam
H0IEB9sDVr,3,30551443624834,Corette Banasiak,Larkin Inc,665-70-7863,4,59648 Merry Park,Corette,Banasiak,410-75-6538,17/12/2019,69153-020,3,24.6,Asteraceae,at ipsum ac tellus semper
sC3X6DvDwS,1,676709815862965086,Betty Wilmott,Hintz-Herzog,649-63-2956,4,9963 Towne Circle,Betty,Wilmott,678-73-8080,27/11/2019,0295-1183,2,15.33,Acarosporaceae,a feugiat et eros vestibulum ac
KIvLN5wAEI,2,6304398371921454265,Aleta Tackes,Haley-Fritsch,301-85-7806,3,3 Independence Hill,Aleta,Tackes,323-27-0588,07/08/2020,0093-0833,5,27.95,Caprifoliaceae,quam sapien varius ut blandit
7S8Sr1TYZd,4,3552975073648478,Meryl Reay,Pfannerstill- Weber and Keebler,524-26-4214,4,11189 Becker Trail,Meryl,Reay,886-07-1764,23/12/2019,50523-488,3,18.88,Fabroniaceae,ultrices mattis odio donec vitae nisi
SgCVBGaWu5,1,6382891171635870,Aurilia Alfwy,Wolff Inc,586-60-5067,2,02 Lerdahl Way,Aurilia,Alfwy,559-52-7027,22/10/2019,49738-130,4,24.53,Callitrichaceae,amet justo morbi ut odio cras mi
EbuNXrZqus,1,5602243090794568,Egbert Sivills,Buckridge- O'Hara and Dietrich,333-21-6241,2,5 Hermina Terrace,Egbert,Sivills,763-57-3982,15/03/2020,0093-8238,4,6.15,Liliaceae,ac nibh fusce lacus purus aliquet at feugiat non
al7Py23oIN,1,5048378857894565,Loralie Hesse,Harris-Nikolaus,895-30-1258,2,268 Walton Way,Loralie,Hesse,247-84-1858,19/04/2020,60637-011,1,1.91,Asteraceae,ultrices posuere cubilia curae duis
xAL0dspE02,3,4041599669371,Cortney Derell,Schuppe- Kihn and Mann,402-40-7698,3,70 John Wall Avenue,Cortney,Derell,167-08-7940,04/07/2020,0173-0737,4,5.81,Hydrophyllaceae,eu interdum eu tincidunt in leo maecenas pulvinar lobortis
g3fFBeyYU1,2,3535485110919744,Lynnet Heap,Sanford LLC,315-26-8805,1,4 Talmadge Way,Lynnet,Heap,126-73-3107,02/05/2020,59779-115,4,16.26,Lecanoraceae,magna vestibulum aliquet ultrices erat tortor sollicitudin
N2eeA7Pe1v,4,5416712084608824,Pail Colin,Conn-Morissette,643-70-6016,3,261 Hollow Ridge Alley,Pail,Colin,781-34-6794,28/12/2019,21695-085,4,8.46,Hypnaceae,dolor sit amet consectetuer adipiscing elit proin
Ysf4dDBwhH,2,3552867307610590,Marys Burn,Barton and Sons,566-24-9377,3,4 Bayside Junction,Marys,Burn,757-12-4712,10/07/2020,62250-619,2,3.72,Brassicaceae,maecenas tincidunt lacus at velit
PAMDGirwF0,1,3541138495640268,Fifine Cursons,Gottlieb LLC,474-45-8315,4,1230 Dorton Drive,Fifine,Cursons,419-66-8740,07/05/2020,42783-601,2,2.48,Rosaceae,adipiscing molestie hendrerit at vulputate vitae nisl
kp8Efrkovc,2,633324748167878918,Seline Mallabar,Murray Inc,833-70-0606,3,3 Brown Crossing,Seline,Mallabar,393-94-4046,08/08/2020,49738-072,1,1.33,Apiaceae,odio in hac habitasse platea dictumst
mELd5LJiVC,4,4905604013649311,Niki Sambells,Kuhn LLC,896-62-7237,4,60080 5th Street,Niki,Sambells,557-61-3165,10/03/2020,50563-179,2,27.59,Arecaceae,habitasse platea dictumst morbi vestibulum velit
z9ubUDng1S,3,6331104893652797362,Carlee Enoch,Rippin- Hudson and Reilly,466-82-8158,4,93514 Packers Point,Carlee,Enoch,721-99-2754,04/07/2020,0185-0371,1,24.9,Poaceae,a odio in hac habitasse platea dictumst maecenas
UjU7NIPK71,3,6759421020452031,Isak Dart,Schuppe- Maggio and Marquardt,771-56-7091,4,6587 Barby Point,Isak,Dart,741-07-6856,29/12/2019,59535-9401,1,4.62,Poaceae,donec diam neque vestibulum eget vulputate ut
rhb0487U8R,3,5602254054297324,Ferdinanda Gandy,Hettinger Group,179-87-4317,4,2887 Bayside Trail,Ferdinanda,Gandy,789-91-2668,26/05/2020,10056-134,3,9.25,Asteraceae,est et tempus semper est
aZFqaoTbU8,2,5602221656540161,Morry Lerven,Nikolaus and Sons,530-11-3733,3,10203 Hansons Crossing,Morry,Lerven,499-29-6455,15/08/2020,56062-944,2,11.88,Asteraceae,justo maecenas rhoncus aliquam lacus morbi
nB5IHfz5pD,3,3586652224379259,Kennith Wagg,Crona-Simonis,133-13-1281,4,00803 International Center,Kennith,Wagg,122-42-1860,27/06/2020,50563-302,3,3.53,Cyperaceae,turpis donec posuere metus vitae ipsum
FIfLsRfT9g,1,67064092937665866,Adan Ingerfield,Barrows-McCullough,750-58-4332,2,019 Memorial Hill,Adan,Ingerfield,388-82-4309,04/12/2019,60512-6442,3,11.15,Asteraceae,justo nec condimentum neque sapien placerat
49zsHCHnoW,2,5551641820923491,Aksel Marriott,Brekke- Stamm and Koss,500-55-8322,2,51 Bowman Way,Aksel,Marriott,876-33-9850,10/10/2019,0378-3850,5,5.61,Catillariaceae,in tempus sit amet sem fusce consequat nulla
2lYmoumHhh,4,56022282043500396,Giulietta Jeffray,Morar- Metz and Boehm,598-68-5234,4,04 Brickson Park Road,Giulietta,Jeffray,613-29-7107,24/02/2020,0093-2069,4,10.86,Fabaceae,nisi nam ultrices libero non
E7kqob9UKI,2,0604817186666993,Sara Dalli,Batz- Rohan and Purdy,719-97-1726,4,40682 Miller Parkway,Sara,Dalli,112-39-2902,22/10/2019,0363-0022,2,8.44,Graphidaceae,elementum ligula vehicula consequat morbi a ipsum integer a
IHsj74nU36,1,3548986884570113,Diena Broadnicke,Ledner Inc,583-36-9267,2,2 Anderson Trail,Diena,Broadnicke,787-94-7597,26/11/2019,51811-377,4,18.0,Brassicaceae,ultrices phasellus id sapien in sapien iaculis
knogVbz4zF,1,502052369905071529,Tina Storcke,Wyman-Larkin,704-38-8940,3,390 Parkside Crossing,Tina,Storcke,477-48-3503,22/12/2019,46123-022,5,6.35,Gentianaceae,eu mi nulla ac enim in
ofotO6oc3B,1,5138419944348065,Elsa Nestoruk,Brekke- Carroll and Rodriguez,326-34-6440,2,0 Sage Terrace,Elsa,Nestoruk,758-25-6375,13/08/2020,59779-704,3,3.24,Poaceae,ante ipsum primis in faucibus orci luctus et
lzXwoDrDQr,3,3547718157632184,Jo-anne Turpey,Wintheiser and Sons,700-76-9118,2,1 Gateway Hill,Jo-anne,Turpey,253-23-2708,28/07/2020,54868-4150,4,28.66,Campanulaceae,ipsum primis in faucibus orci luctus
iO7WhjC1IN,3,3560779400221128,Aylmar Iliffe,Powlowski- Howe and Schumm,150-51-6341,4,26988 Lien Trail,Aylmar,Iliffe,532-54-3234,13/05/2020,11673-008,1,20.29,Asteraceae,in quam fringilla rhoncus mauris enim
nhsyvcaO6U,1,4905845083187944,Chere Rampage,Funk- Hayes and Thompson,208-01-9952,2,180 Pawling Trail,Chere,Rampage,190-88-9731,04/11/2019,55154-0680,4,13.33,Boraginaceae,quam sapien varius ut blandit non interdum in ante
i13B6V4HRx,2,201658810529307,Fidole Moring,Becker-Pacocha,868-33-1938,3,628 Mcbride Parkway,Fidole,Moring,792-53-0122,23/10/2019,0074-3045,1,6.99,Lecanoraceae,praesent blandit nam nulla integer
NWH1SEADKJ,3,3587006139875985,Julina Manning,Dickens Inc,641-47-8459,2,26041 Kingsford Parkway,Julina,Manning,343-69-0238,14/10/2019,33992-1889,3,18.53,Pinaceae,vestibulum velit id pretium iaculis diam erat fermentum justo
1JNhGTI9No,3,3535315935532184,Felicity Dumbare,Lakin and Sons,631-36-7925,1,88 Bobwhite Road,Felicity,Dumbare,815-02-8687,08/09/2020,55316-090,3,21.16,Plumbaginaceae,tempus vivamus in felis eu sapien cursus vestibulum
iGSDYmDDuh,4,3549958799670147,Eliot Vossing,Torphy Group,620-25-3452,1,538 Corben Place,Eliot,Vossing,479-16-5058,11/04/2020,62257-785,4,21.42,Asteraceae,congue eget semper rutrum nulla
TuGKN7gidP,4,4905501509538950,Paulina Ayton,Paucek and Sons,105-76-2475,4,476 Maple Point,Paulina,Ayton,205-70-8464,27/06/2020,55910-233,1,28.51,Poaceae,dictumst aliquam augue quam sollicitudin
YW3bckzZSI,2,3543747234483232,Cindie Scurrey,Mohr Inc,375-37-1291,1,604 Pawling Place,Cindie,Scurrey,132-77-0229,29/09/2019,54868-2974,5,12.3,Fabaceae,luctus cum sociis natoque penatibus et magnis dis
r3q3cXtOJi,2,6377935295015878,Wheeler Mahon,Kuphal and Sons,416-55-2146,4,39978 Debra Road,Wheeler,Mahon,476-12-8496,18/09/2020,59779-706,1,23.68,Asteraceae,sit amet turpis elementum ligula vehicula consequat morbi a ipsum
BrmEMe1BY1,3,5602228959958768,Vinnie Hillin,Friesen and Sons,567-12-7719,2,8722 Gale Lane,Vinnie,Hillin,180-45-6600,29/01/2020,0781-5939,5,2.23,Myrtaceae,nunc nisl duis bibendum felis sed interdum
feEhc8B7eI,1,36604486942250,Bryn Wherrit,Rutherford Group,844-65-5702,2,70508 Service Hill,Bryn,Wherrit,489-70-0257,19/09/2019,43598-207,5,11.89,Poaceae,duis faucibus accumsan odio curabitur
arXczL3nXI,3,560224555721814123,Chrisse Stalley,Rolfson and Sons,405-04-7086,4,7353 Corry Place,Chrisse,Stalley,230-53-4119,26/11/2019,57237-081,3,7.05,Brassicaceae,pellentesque viverra pede ac diam cras pellentesque volutpat dui maecenas
mmbl5q03ei,3,5100145893265034,Shalna Jeens,Price LLC,345-28-1288,4,8942 North Hill,Shalna,Jeens,200-13-2578,16/10/2019,55289-171,5,13.12,Asteraceae,justo in hac habitasse platea dictumst etiam faucibus
Ifymo30XZ7,4,3547618051210436,Alexio McGaugie,Carter- Padberg and Hane,881-14-9804,3,78 2nd Road,Alexio,McGaugie,595-47-9974,21/06/2020,50844-753,1,27.77,Rutaceae,consequat ut nulla sed accumsan felis
pLJ9Px3PJH,1,56022484146406808,Herb Stair,Leannon- Torphy and Gorczany,432-60-3206,3,188 Stang Circle,Herb,Stair,539-94-6318,28/01/2020,37205-670,5,8.9,Ranunculaceae,vulputate nonummy maecenas tincidunt lacus at velit vivamus vel
h3hQBSY3Ag,3,201742624357061,Denny Kiebes,Denesik-Gorczany,439-71-3259,1,63600 Fuller Circle,Denny,Kiebes,561-27-6583,10/07/2020,60681-2804,3,7.19,Asteraceae,massa id nisl venenatis lacinia aenean sit amet
ZTzWyLiLTY,1,6762651274761224536,Xaviera Petasch,Torphy LLC,396-12-4177,3,76507 Red Cloud Point,Xaviera,Petasch,652-86-5980,06/04/2020,60456-576,4,17.07,Parmeliaceae,accumsan tellus nisi eu orci
Narl1f0GWK,3,3545525981042544,Francesco Whaley,Flatley- King and Hermiston,514-67-4915,2,179 Dexter Crossing,Francesco,Whaley,876-16-0583,23/11/2019,0310-0950,3,11.78,Onagraceae,sed vel enim sit amet nunc viverra dapibus nulla
uZTO3Ih3dV,1,5610973319500269,Scarlett Vann,Baumbach LLC,233-26-1401,2,6381 Thompson Point,Scarlett,Vann,599-41-4396,06/05/2020,49288-0644,2,11.21,Cyperaceae,eget tincidunt eget tempus vel pede morbi porttitor
3V7iEiAcTm,3,4175009133525362,Retha Danforth,Treutel Group,343-22-1522,4,78 Summit Avenue,Retha,Danforth,405-59-2417,29/02/2020,58004-002,5,25.6,Poaceae,vestibulum rutrum rutrum neque aenean auctor
2XfSurzCJ8,4,3532451657325862,Vidovik Mathwin,Sipes LLC,518-95-0521,1,132 Manitowish Trail,Vidovik,Mathwin,694-01-1951,26/11/2019,51531-4399,4,22.16,Fagaceae,est phasellus sit amet erat nulla
VlWJdCKpob,1,374288613225233,Sigrid Dinley,Hills Inc,838-70-8911,1,14141 Farmco Court,Sigrid,Dinley,859-46-2233,08/05/2020,57349-913,1,17.19,Amaranthaceae,id mauris vulputate elementum nullam
OKq6Kn27Wo,2,3589109100813528,Davita Hopfer,Herzog-Rutherford,519-42-4332,4,20497 Caliangt Pass,Davita,Hopfer,250-51-2590,23/07/2020,58194-013,4,12.23,Polemoniaceae,vestibulum vestibulum ante ipsum primis in faucibus orci
gb3XVp76JR,4,3539039540335645,Page Scotting,Blanda Inc,679-74-8422,2,7 Vera Road,Page,Scotting,866-72-5393,09/12/2019,68428-076,2,18.8,Lentibulariaceae,nunc proin at turpis a pede posuere nonummy
Q2lvzNWsZq,3,201671060842528,Gardiner Beuscher,Gerlach-Nolan,826-55-1495,2,068 Sundown Center,Gardiner,Beuscher,257-30-3565,01/04/2020,55910-167,4,23.91,Timmiaceae,magna vestibulum aliquet ultrices erat tortor sollicitudin mi sit
Rou1RbLjyt,3,5293122269639123,Regen Tamburo,Ferry- Legros and Cormier,707-78-4898,4,924 Waxwing Drive,Regen,Tamburo,305-59-7430,16/11/2019,59779-723,1,15.92,Linaceae,egestas metus aenean fermentum donec
KXcMejzM70,1,3566325941045685,Meridith Gladwish,Nader and Sons,614-17-6885,3,05 Spenser Road,Meridith,Gladwish,696-33-2781,14/06/2020,49781-025,5,29.5,Brassicaceae,eget rutrum at lorem integer tincidunt ante
CuYqkBHpBT,1,5100137296951328,Guillema Jest,Beahan-Mayert,434-23-8251,1,734 Dakota Road,Guillema,Jest,549-11-8083,06/02/2020,42669-004,1,24.92,Brassicaceae,ipsum dolor sit amet consectetuer adipiscing elit proin risus praesent
F9Z6Ga6Bbh,1,3533467736507956,Caroline Rowatt,Cruickshank- Schoen and Gleichner,595-83-4611,1,03674 Eggendart Center,Caroline,Rowatt,616-04-1649,04/05/2020,65224-800,4,1.33,Sapindaceae,magnis dis parturient montes nascetur ridiculus mus vivamus vestibulum sagittis
BJHa13sc8Y,2,3540992117507912,Jillana Holliar,Haag and Sons,203-33-9673,1,340 Twin Pines Drive,Jillana,Holliar,745-95-2102,20/06/2020,67046-044,3,5.88,Heliconiaceae,erat fermentum justo nec condimentum neque
I9DPkcGEp8,4,67714455742677653,Nolana Day,Hackett Inc,697-55-2234,3,5008 Colorado Pass,Nolana,Day,195-87-7858,05/01/2020,68094-757,1,26.26,Euphorbiaceae,nulla justo aliquam quis turpis eget elit sodales scelerisque
wV8gOQiBNs,2,6709638863590948965,Yale Dumbrill,Hackett-Cormier,873-36-4996,1,78105 Stuart Plaza,Yale,Dumbrill,760-31-2299,03/08/2020,55910-348,3,14.85,Fabaceae,luctus ultricies eu nibh quisque id
EtcPDVCZ6Z,3,5100172061585092,Kathleen Sharplin,Feest Inc,819-19-8527,2,8353 Daystar Road,Kathleen,Sharplin,135-44-9094,03/03/2020,42571-100,5,4.44,Cyperaceae,turpis enim blandit mi in porttitor pede justo eu
132DzJ1sVK,3,4903200150016109,Kitty Seddon,Bartell Group,621-93-5393,3,70 Forest Run Plaza,Kitty,Seddon,772-38-9385,12/07/2020,0456-1550,3,2.2,Rhachitheciaceae,montes nascetur ridiculus mus vivamus vestibulum sagittis sapien
V3BJg9maEK,4,5132087760541539,Sadie Balasini,Jerde-Ryan,160-03-2658,4,6970 Old Shore Parkway,Sadie,Balasini,262-79-3575,23/01/2020,68084-374,5,11.07,Disceliaceae,mus etiam vel augue vestibulum rutrum
AOTtztnAla,4,5100175342882782,Bibi Kohneke,Connelly-Strosin,780-52-4032,4,345 Summerview Trail,Bibi,Kohneke,582-07-5541,18/01/2020,36987-1266,1,9.17,Fabaceae,amet nulla quisque arcu libero rutrum ac lobortis vel dapibus
eXHMtwSmdX,1,6763262462724436,Shandra Oakeby,Jones-Hudson,774-48-7014,4,10 Miller Drive,Shandra,Oakeby,250-29-1902,24/07/2020,49215-0003,5,15.18,Rosaceae,cursus id turpis integer aliquet massa id lobortis convallis tortor
1pAp6UB8hw,1,3560307245715292,Jeffry Meardon,Doyle-Williamson,722-51-0823,1,0 Miller Junction,Jeffry,Meardon,640-88-3071,17/09/2020,50353-101,5,23.43,Asteraceae,est et tempus semper est quam pharetra magna
9QyYhAl6Vw,2,3575648742633808,Lorilyn Casebourne,Gerhold- Morar and Schroeder,796-82-5718,1,194 Nova Circle,Lorilyn,Casebourne,319-02-9287,18/07/2020,49726-029,4,7.38,Poaceae,nullam porttitor lacus at turpis donec posuere
itgCOfo8OX,4,3528436187841823,Lock Lovick,Reilly-Parisian,559-56-1015,4,4042 Clove Trail,Lock,Lovick,541-82-4272,18/09/2020,52533-026,5,15.77,Moraceae,mauris ullamcorper purus sit amet nulla
dpgxOAPP9p,1,3528256986351778,Garth Valiant,O'Keefe- Upton and Schmeler,700-72-2639,1,4 Namekagon Hill,Garth,Valiant,131-28-9078,04/11/2019,0067-6424,1,11.66,Poaceae,etiam pretium iaculis justo in hac habitasse platea dictumst
BP7DLyiO1u,3,36137279857419,Salmon Jacquet,Ullrich-Koepp,357-83-0579,4,361 Tomscot Avenue,Salmon,Jacquet,271-85-2118,29/10/2019,51918-1003,1,16.78,Cyperaceae,et commodo vulputate justo in blandit ultrices enim
4RvO16IfCc,4,3581144072938027,Sim Paskin,Heaney- Schmeler and Beahan,811-50-5884,4,87 Lindbergh Avenue,Sim,Paskin,740-94-9596,07/07/2020,63776-628,1,15.81,Fabaceae,luctus tincidunt nulla mollis molestie lorem quisque ut erat
YdB3YB1ZJw,1,4844804194676331,Ermin Simms,Hayes-Larkin,186-12-7468,3,754 High Crossing Way,Ermin,Simms,891-20-1877,11/11/2019,0268-0721,3,28.26,Solanaceae,mollis molestie lorem quisque ut
VTIiKWr7DL,3,374288150282464,Vivian Maden,Purdy-Hamill,529-76-9859,1,5 Reindahl Pass,Vivian,Maden,451-58-2980,14/04/2020,37808-036,4,19.96,Onagraceae,felis donec semper sapien a
9LGfPBhQCW,4,060423343415891495,Tiffy Apedaile,Gleason- Prohaska and Paucek,894-48-3189,3,41921 Northfield Point,Tiffy,Apedaile,892-39-0372,28/03/2020,68026-527,3,7.59,Berberidaceae,non interdum in ante vestibulum
rMa3eYqtOX,1,3587867627242560,Hildegarde Caldicott,Wiegand- Schiller and Feest,147-01-6307,1,65918 Thackeray Road,Hildegarde,Caldicott,657-51-1930,27/02/2020,55154-0459,2,6.38,Cyperaceae,suspendisse ornare consequat lectus in est risus auctor sed
yivU6fwGE6,2,3558899096507913,Hugues Ellinor,Von- Turcotte and Cruickshank,473-43-1935,2,627 Kensington Parkway,Hugues,Ellinor,362-62-6188,20/05/2020,65044-6515,5,12.99,Scrophulariaceae,purus aliquet at feugiat non pretium quis lectus
r7V3BbuROs,2,3583937631574284,Ninnetta Barta,Schumm- Ankunding and McDermott,870-07-5731,4,91826 Hallows Pass,Ninnetta,Barta,488-04-0850,06/11/2019,16590-846,1,3.62,Rhamnaceae,elementum nullam varius nulla facilisi cras non velit nec
lylQzQS8US,4,3575182706370819,Elena Iggo,Botsford- Orn and Hilpert,382-78-2510,3,79 Coleman Way,Elena,Iggo,611-97-8080,05/04/2020,36987-3400,5,27.79,Asteraceae,ultrices posuere cubilia curae donec
L2h7bUi81K,4,3571521006473647,Mayor Belt,Dooley- McClure and Welch,125-54-7545,4,9 Burrows Court,Mayor,Belt,252-05-8876,08/12/2019,60505-0402,5,19.81,Polygalaceae,sed vel enim sit amet nunc viverra dapibus
67XqO4TNmj,2,3532850269056585,Cherri Light,Jast-Jacobs,249-97-4857,4,78938 Bartillon Trail,Cherri,Light,446-15-4877,17/08/2020,76398-001,4,29.9,Poaceae,vivamus vel nulla eget eros elementum
bdiMk9rJgN,4,3568878309443056,Gerrie Odams,Cartwright-Shanahan,139-17-2532,3,58038 Kinsman Pass,Gerrie,Odams,819-79-0691,14/07/2020,55312-034,4,7.29,Fabaceae,tincidunt eu felis fusce posuere felis sed lacus
szAv8uSddk,3,5602213837082577,Killy Harpur,Hane and Sons,196-91-0924,2,66621 Oriole Point,Killy,Harpur,415-83-5454,13/12/2019,0574-0153,2,2.71,Fabaceae,rhoncus aliquam lacus morbi quis tortor id
QopirqKX8n,4,3530522515218416,Gilly Methringham,Blick-Lindgren,833-66-2682,1,2685 Village Lane,Gilly,Methringham,893-79-4266,06/12/2019,51672-1309,4,16.02,Iridaceae,nulla ac enim in tempor turpis nec euismod scelerisque quam
2xcYkNmlES,3,3553347161602396,Karon Rhelton,Legros-Witting,190-30-9678,2,76 New Castle Plaza,Karon,Rhelton,174-79-8943,05/09/2020,63304-311,1,5.22,Parmeliaceae,elementum in hac habitasse platea dictumst morbi vestibulum velit
N12FkN51pP,1,5602244098668184,Addi Arnoll,Weimann and Sons,455-01-4933,3,499 Hollow Ridge Parkway,Addi,Arnoll,463-84-8367,12/01/2020,30805-009,3,14.77,Poaceae,vestibulum sit amet cursus id turpis integer
AUXEuiOm3Y,1,3566949690206410,Vitoria Pollock,Simonis-Sporer,674-39-2554,4,6 Pawling Road,Vitoria,Pollock,824-92-1036,07/05/2020,0067-6292,3,11.9,Poaceae,diam neque vestibulum eget vulputate
hHOZYuZb8C,3,3528690219475477,Bob Cirlos,Kreiger- Trantow and Willms,309-04-7739,4,1967 Moulton Place,Bob,Cirlos,665-41-3928,22/07/2020,46994-359,3,17.91,Asteraceae,tellus in sagittis dui vel nisl duis ac nibh
wrehKXrUDT,4,3550396023742281,Sigismund Murie,Shanahan-Maggio,832-24-0775,4,00 Ronald Regan Avenue,Sigismund,Murie,613-75-2586,02/09/2020,49348-778,5,5.74,Cactaceae,pede justo lacinia eget tincidunt
j2dbGQxy44,2,30537648077027,Andriette Scarce,Sawayn LLC,712-69-5595,4,4311 Schiller Circle,Andriette,Scarce,326-55-2899,02/12/2019,43353-819,4,19.0,Berberidaceae,mattis odio donec vitae nisi nam ultrices libero non
1bXrwSJzlP,2,374622923122955,Gladi Kardos,Green- VonRueden and Purdy,179-94-1117,3,79 Spohn Parkway,Gladi,Kardos,353-01-8403,30/12/2019,59575-501,1,27.65,Polygonaceae,non pretium quis lectus suspendisse
4qUsMOy3nX,2,4041373786040638,Paulette Gruszka,Heathcote Inc,562-61-9201,4,665 Kipling Circle,Paulette,Gruszka,185-11-8165,02/05/2020,64117-953,2,4.31,Boraginaceae,morbi vel lectus in quam fringilla rhoncus mauris enim leo
AsVwnwwHV8,4,3568642578856657,Olimpia Tabour,Lang-Okuneva,357-97-0591,1,443 Maywood Drive,Olimpia,Tabour,344-26-6874,15/01/2020,0268-1494,4,21.28,Fabaceae,lectus vestibulum quam sapien varius ut blandit non
EqBuYKrTwG,1,3554667425572609,Clerc Kenrack,Gutmann LLC,331-40-7888,4,28 Spaight Place,Clerc,Kenrack,150-78-4952,27/05/2020,68428-110,3,17.12,Orobanchaceae,adipiscing elit proin risus praesent lectus vestibulum
xJ5CZUj1Ts,4,201928727265869,Cacilie Baitman,Emmerich and Sons,775-98-4520,3,03055 American Ash Junction,Cacilie,Baitman,274-77-9033,10/05/2020,46672-053,2,5.12,Teloschistaceae,risus dapibus augue vel accumsan tellus nisi eu
fQqoyUAMPx,1,4175005702810169,Ealasaid Haug,Okuneva- Rutherford and Stracke,887-74-6105,2,51912 Dahle Alley,Ealasaid,Haug,500-48-1117,26/04/2020,61715-058,4,1.81,Apiaceae,quam pede lobortis ligula sit amet eleifend pede libero quis
KNKYDncCmE,3,201952533011804,Desmund Koppeck,Hilpert- Paucek and Johns,676-15-7851,4,860 Sachs Court,Desmund,Koppeck,514-02-7027,17/02/2020,69097-195,2,19.03,Caryophyllaceae,dapibus augue vel accumsan tellus nisi
ukikECxOis,2,201815306145598,Natal Mallya,Boyer- Christiansen and Cummings,167-02-7888,4,45 Dottie Terrace,Natal,Mallya,569-51-7649,26/06/2020,37205-661,1,27.9,Fabaceae,ante vestibulum ante ipsum primis in faucibus
sHrwawruyP,3,3567744072822333,Addison Sor,Waters-Cole,588-06-9759,2,5060 Anderson Lane,Addison,Sor,604-27-1523,01/12/2019,0409-1630,4,14.26,Hamamelidaceae,orci nullam molestie nibh in lectus pellentesque at nulla
rZAczNF7YU,2,3558455679536777,Fay Scipsey,Huels-Bosco,556-24-9995,2,8 Clove Avenue,Fay,Scipsey,761-96-8821,05/01/2020,0173-0675,3,10.75,Sphagnaceae,venenatis turpis enim blandit mi in porttitor pede
FSKqfNxzSF,2,3529800982569591,Rawley Ciciari,Corwin-Grant,560-45-8278,2,64 Beilfuss Street,Rawley,Ciciari,876-27-9379,17/01/2020,49288-0020,2,19.82,Asteraceae,augue quam sollicitudin vitae consectetuer
EX5rUbvXgY,4,3575772426917392,Hollyanne Teaz,Spinka Group,636-49-7109,1,9 Coleman Street,Hollyanne,Teaz,547-20-1224,21/10/2019,58503-044,5,5.51,Parmeliaceae,ut at dolor quis odio
RoFc87ErVR,3,56107080245772104,Keely Olivazzi,Bode-Terry,667-69-8369,2,45 Donald Drive,Keely,Olivazzi,332-74-3359,25/01/2020,24236-720,2,14.55,Asteraceae,non quam nec dui luctus rutrum nulla
l2XskmLHSk,1,3566659524626010,Frasco Abramamov,Kerluke Group,292-50-7240,4,9455 David Avenue,Frasco,Abramamov,332-40-6326,17/05/2020,60505-0688,4,6.44,Gesneriaceae,praesent blandit nam nulla integer
Az5mGIa1xf,1,3573364374926005,Jordanna Bonhomme,Rutherford-Fisher,263-55-7899,3,93843 Monica Drive,Jordanna,Bonhomme,198-84-4214,18/02/2020,65862-102,3,14.24,Rosaceae,at turpis donec posuere metus vitae
ViEs7O1OBl,3,5602249802813513,Hervey O'Neal,Schuster-Dietrich,391-34-2819,1,120 Ilene Street,Hervey,O'Neal,121-63-9259,13/10/2019,55111-610,2,7.93,Primulaceae,nunc commodo placerat praesent blandit nam
udYuDDiRaL,4,6395698015509426,Rosalia Neylan,Okuneva- Bashirian and Wunsch,886-77-9005,4,80 Mesta Trail,Rosalia,Neylan,120-35-5415,30/06/2020,10742-8667,1,10.03,Fabaceae,sapien varius ut blandit non interdum in ante vestibulum
VHj9MPdDc3,3,3557057893643487,Dolorita Abdee,Klocko-Sporer,160-09-0319,1,3632 Mayfield Trail,Dolorita,Abdee,135-44-5294,30/08/2020,0615-0378,1,16.84,Poaceae,nibh in lectus pellentesque at nulla suspendisse potenti
