vozUCtvl8e,4,3557971898083756,Kristien Caddell,Kuhn- Stokes and Johns,135-68-9934,1,640 Fallview Pass,Kristien,Caddell,545-82-6332,21/09/2019,49999-252,1,25.34,Asteraceae,montes nascetur ridiculus mus etiam vel augue vestibulum rutrum
xvI9OdZE5i,1,4422163398827673,Cassi Hadrill,Schinner LLC,340-70-7647,1,79996 Del Sol Plaza,Cassi,Hadrill,553-05-2702,16/06/2020,49288-0278,4,16.1,Fabaceae,metus aenean fermentum donec ut mauris
Jl65TtPsYY,2,5373321446206573,Sharl Poulglais,Parker and Sons,690-77-3778,1,77 Eastlawn Place,Sharl,Poulglais,852-49-3026,25/03/2020,44911-0072,5,20.23,Papaveraceae,in quis justo maecenas rhoncus aliquam lacus morbi quis tortor
6BbnouljU0,1,06044305081048686,Athena Dotson,Welch-Dicki,321-74-6528,2,26154 Burning Wood Drive,Athena,Dotson,312-17-8024,05/08/2020,65841-800,1,2.29,Poaceae,donec odio justo sollicitudin ut suscipit a feugiat
btWv5FgsGw,2,3557201188847094,Kristien Vedeneev,Feil-Tillman,692-55-7087,2,26 5th Court,Kristien,Vedeneev,197-25-6838,14/05/2020,0093-4742,1,15.8,Lecanoraceae,amet sem fusce consequat nulla nisl nunc nisl duis
7PUi7udfY2,4,4844496655042234,Dillon Tremblet,Runolfsson- Lang and Hamill,417-80-6153,2,6 Harbort Parkway,Dillon,Tremblet,892-40-4722,25/10/2019,44087-8090,4,23.85,Cyperaceae,ante ipsum primis in faucibus orci
7S9ulOSP3b,1,5128396918974898,Leanor Fasey,Kilback-Yost,562-05-7160,3,1 Manitowish Place,Leanor,Fasey,594-80-3372,16/08/2020,51531-8360,5,10.97,Rosaceae,dui luctus rutrum nulla tellus in
PlEC4LZhwi,4,3546429294606039,Neysa Goodban,Sporer-Beatty,148-31-5214,2,0 Arrowood Road,Neysa,Goodban,479-91-0041,10/04/2020,67542-040,2,14.03,Scrophulariaceae,felis ut at dolor quis odio
bkYAoYdOam,2,560224876210471419,Barnard Muslim,Jaskolski and Sons,234-26-4143,2,07 Goodland Lane,Barnard,Muslim,683-86-3817,19/06/2020,58668-2031,1,14.81,Solanaceae,turpis adipiscing lorem vitae mattis nibh ligula nec
usdigYMpTY,1,3564488838044526,Mortimer Darter,Kuhic Inc,112-45-1930,4,83 Sunbrook Lane,Mortimer,Darter,361-43-1233,28/01/2020,62211-350,5,11.26,Polemoniaceae,sapien cursus vestibulum proin eu mi
25AC6py9ge,1,3588917571657062,Verney Meece,Boehm-VonRueden,350-44-1854,1,1588 Sunbrook Park,Verney,Meece,349-81-9622,30/09/2019,15062-003,2,15.59,Poaceae,pede justo eu massa donec
VuwlEbiX2C,3,3576089690722062,Camille Sammut,Stehr LLC,319-59-5958,4,801 Northview Park,Camille,Sammut,520-80-3831,11/02/2020,61543-7788,2,25.85,Convolvulaceae,diam id ornare imperdiet sapien urna pretium nisl ut
Lyqj8IgoiM,2,5048371585329277,Shandee Patesel,Hickle Group,625-01-5155,3,091 Algoma Court,Shandee,Patesel,569-69-5406,02/06/2020,55513-074,4,18.21,Poaceae,consectetuer eget rutrum at lorem integer
5EIeuRZeBd,1,5602220462904298,Burtie Pickervance,Gislason- Streich and Bernhard,315-68-9515,4,378 Kennedy Place,Burtie,Pickervance,716-66-8049,27/12/2019,65044-2362,2,7.17,Fabaceae,montes nascetur ridiculus mus vivamus vestibulum sagittis
cvQqAlQj5S,4,374288458543153,Jaye Eland,Emard- Watsica and O'Reilly,882-98-6317,2,0 Oneill Drive,Jaye,Eland,229-01-3559,20/06/2020,51769-107,5,12.18,Myrsinaceae,justo maecenas rhoncus aliquam lacus morbi
63pEiZOGS4,4,3540945795787115,Bradan Saunton,Schimmel Group,114-91-2570,4,93364 Montana Center,Bradan,Saunton,843-51-6356,16/10/2019,0268-6107,5,14.96,Hydrocharitaceae,quis odio consequat varius integer ac leo
co4Yt44jgg,3,3541707941353989,Allis Pavie,Bernier- Bins and Skiles,893-25-1904,4,9 Elgar Lane,Allis,Pavie,275-91-3443,01/11/2019,55319-534,2,26.33,Geraniaceae,sem mauris laoreet ut rhoncus aliquet pulvinar
cbXSUxODcC,4,4026290200723509,Viviene Jolland,Jenkins-Corkery,800-46-1718,2,17 Nancy Point,Viviene,Jolland,267-48-5723,16/02/2020,0409-2288,3,11.97,Poaceae,ipsum praesent blandit lacinia erat vestibulum sed
Yclc86bV7g,4,5610637600539977,Henrik Solomonides,Dickens-Mayer,577-63-2134,2,30970 Loeprich Alley,Henrik,Solomonides,517-88-2362,03/07/2020,43269-847,3,23.15,Solanaceae,aenean lectus pellentesque eget nunc donec quis
9tDYWgS5f2,4,3584136840080477,Reamonn Goodwill,Reilly-Fritsch,724-99-4343,1,9 Beilfuss Parkway,Reamonn,Goodwill,830-72-0253,10/03/2020,13537-230,1,19.89,Zingiberaceae,porttitor pede justo eu massa donec dapibus
tzaT6ECnFs,1,4405568829591956,Venita Jotcham,Cruickshank-Jaskolski,437-61-4309,4,83218 Sherman Street,Venita,Jotcham,118-73-5240,18/12/2019,10956-003,2,29.84,Rubiaceae,praesent lectus vestibulum quam sapien varius ut
jhjP2TClnG,2,372301221555065,Taylor Carr,Mohr LLC,380-01-9748,3,27542 Boyd Junction,Taylor,Carr,587-15-1083,28/03/2020,48951-2049,1,11.82,Fabaceae,quis turpis sed ante vivamus tortor duis
xWpVExKIOi,1,4041596639300433,Syd Crampin,Satterfield- Anderson and Vandervort,473-84-6560,3,93 Haas Lane,Syd,Crampin,607-64-1717,27/12/2019,36987-3337,3,21.48,Aspleniaceae,elementum eu interdum eu tincidunt in leo maecenas pulvinar lobortis
kwrHXOU1wq,2,5410512659854480,Lavinia Bidwell,Batz Group,442-61-6085,2,0 Moose Court,Lavinia,Bidwell,590-01-8336,26/10/2019,55714-2274,4,9.26,Grimmiaceae,cubilia curae donec pharetra magna
4bvhLqMHxR,1,3580491362320551,Domeniga Hewins,Sipes-Collins,819-17-4724,2,92 Kipling Park,Domeniga,Hewins,657-61-3082,20/10/2019,37205-730,4,12.06,Asteraceae,lacinia aenean sit amet justo morbi ut
XGswDG44zd,3,3574765090714278,Dominick Tall,Hamill- Price and Gaylord,592-16-3910,3,248 Welch Alley,Dominick,Tall,486-64-9504,08/07/2020,61547-102,5,29.76,Dryopteridaceae,lacinia aenean sit amet justo morbi ut odio cras
pctPxw3nff,4,201567126864847,Meris Dahill,Bartoletti-Wuckert,764-80-6527,4,3035 Pine View Plaza,Meris,Dahill,878-82-9184,05/12/2019,49999-610,2,2.71,Aloaceae,ultrices posuere cubilia curae nulla dapibus dolor vel est
dtCCRaQoQs,1,6706418288572962895,Danell Priel,Wolff- O'Connell and Keeling,621-28-7627,3,591 Almo Crossing,Danell,Priel,305-49-5110,29/06/2020,11523-7363,5,6.25,Solanaceae,nisi volutpat eleifend donec ut dolor morbi vel lectus
lCevXdZfua,4,379436317470929,Tania Pinkney,Botsford LLC,431-28-6891,2,89323 Lotheville Place,Tania,Pinkney,453-87-4482,11/12/2019,11673-227,2,24.96,Rosaceae,pellentesque ultrices phasellus id sapien in sapien iaculis
jMKaAFnAFt,1,5100141852055250,Arlyne Dorbin,Walter and Sons,365-16-0499,1,43257 Thompson Terrace,Arlyne,Dorbin,502-79-1119,20/05/2020,0548-3012,1,1.75,Campanulaceae,diam neque vestibulum eget vulputate ut ultrices
jDMJjjEt2O,3,3538696970209326,Roscoe Scobbie,Stiedemann-Jakubowski,164-28-1956,4,8370 Lake View Hill,Roscoe,Scobbie,651-83-6937,31/01/2020,67938-0947,2,20.15,Fabaceae,porta volutpat quam pede lobortis
eGPmubiZQ3,2,5010122953973004,Kerk Yate,Stiedemann-Ratke,367-44-4394,2,7 Charing Cross Court,Kerk,Yate,485-52-0673,05/02/2020,0482-0061,2,11.71,Lamiaceae,eu nibh quisque id justo sit amet sapien dignissim vestibulum
nCTtIKbBbI,3,3586293704106845,Jehanna Bridge,Kozey-Howe,182-67-6614,3,5 Hermina Pass,Jehanna,Bridge,165-75-6305,10/11/2019,76008-1272,5,10.82,Euphorbiaceae,massa donec dapibus duis at velit eu est
l3R4UO98dx,4,3537015528148392,Hussein Gudgion,Hauck- Mills and Russel,400-60-2808,4,4 Browning Terrace,Hussein,Gudgion,708-27-6673,20/07/2020,49288-0793,5,26.24,Hookeriaceae,egestas metus aenean fermentum donec ut
AAYz4dy0Rv,4,3549589596411284,Nicoline Fuxman,Schuppe-Schaefer,871-21-3306,4,3596 Derek Pass,Nicoline,Fuxman,176-10-9530,05/12/2019,51393-7436,3,25.6,Blechnaceae,tincidunt eu felis fusce posuere felis
IhsiXKOgHR,3,3539101984717835,Gabbie Voden,Kuvalis-Ferry,328-17-7214,3,0185 Springview Alley,Gabbie,Voden,199-84-5789,29/04/2020,24477-040,2,15.01,Brassicaceae,amet lobortis sapien sapien non
4AywOBXRge,4,343735233829982,Rene Geall,Wolf Inc,217-27-5038,4,6 Veith Street,Rene,Geall,170-15-8597,13/11/2019,63730-292,1,24.14,Dipsacaceae,dictumst etiam faucibus cursus urna ut tellus
PL7YFW5jgJ,4,201882995951645,Nathanil Jobb,Gulgowski-Kohler,327-80-5730,3,83251 Di Loreto Junction,Nathanil,Jobb,691-76-2652,22/05/2020,36987-3052,3,6.56,Rubiaceae,nibh in quis justo maecenas rhoncus aliquam lacus
D8oQlTXhpm,2,67092001400558736,Carroll Neillans,Bayer-Mertz,138-10-3465,4,7 Sage Plaza,Carroll,Neillans,405-21-5178,12/05/2020,55714-4533,2,7.16,Acarosporaceae,nullam orci pede venenatis non sodales
fc5mvZJNgr,2,3561508613283008,Maren Pfaffe,Frami- Pouros and Howe,668-16-2020,3,9 Quincy Avenue,Maren,Pfaffe,824-99-2548,20/06/2020,68788-9095,1,12.52,Asteraceae,semper sapien a libero nam dui proin leo odio porttitor
ILM4ZQPvgv,1,5007664230993169,Maurits Cristou,Pfannerstill-Renner,293-17-4843,1,2478 Montana Road,Maurits,Cristou,166-90-9943,18/08/2020,49781-050,2,10.74,Rosaceae,duis faucibus accumsan odio curabitur convallis duis consequat
y6WdcvRPAZ,1,5602214064900609369,Ozzy Brechin,Price LLC,610-08-4818,4,3 Basil Circle,Ozzy,Brechin,201-84-3246,11/01/2020,0942-6496,5,18.91,Rosaceae,interdum mauris non ligula pellentesque ultrices
YrWzC0zRmj,4,3588920283073990,Stesha Funcheon,Franecki-Tremblay,318-97-0843,4,3 Butterfield Court,Stesha,Funcheon,444-13-3540,23/10/2019,15127-226,5,1.81,Marattiaceae,ante ipsum primis in faucibus orci luctus et ultrices
lxAltCCRaR,2,5610481287535127,Hallsy Constanza,Dietrich-Zboncak,677-37-7703,1,92 Debs Alley,Hallsy,Constanza,656-59-5412,11/07/2020,54868-2331,4,7.62,Brassicaceae,nibh in lectus pellentesque at nulla suspendisse potenti cras
5u6puyPawy,2,201941545993166,Bambi Harfoot,Quitzon-Ledner,111-63-0920,1,9 Duke Pass,Bambi,Harfoot,400-51-3349,11/07/2020,0363-0692,1,9.96,Teloschistaceae,fusce posuere felis sed lacus morbi
bBHrSL2tuv,4,3573755920675881,Tuck Saddington,Emmerich-Kulas,609-05-0759,1,6234 Pankratz Plaza,Tuck,Saddington,403-99-2147,04/04/2020,68788-9107,3,4.04,Chenopodiaceae,ut nunc vestibulum ante ipsum primis in
NiA3TOOOwP,1,5602211100181654,Michal Lightollers,Herman- Cummerata and Gleason,148-20-2069,3,20588 Gale Place,Michal,Lightollers,767-29-3917,15/08/2020,21695-830,2,23.37,Porpidiaceae,quis augue luctus tincidunt nulla mollis molestie lorem quisque
1lviEoY592,4,3548457958377421,Cordey Humpherson,Bernhard-Turcotte,426-27-7978,4,6120 Carioca Avenue,Cordey,Humpherson,538-59-7468,08/05/2020,52584-153,2,24.15,Brassicaceae,magnis dis parturient montes nascetur ridiculus mus vivamus vestibulum sagittis
WGGLxKQfUA,4,676728022922822459,Jenn Dinsmore,Pfannerstill-Kuhic,528-48-8125,2,1 Stang Lane,Jenn,Dinsmore,809-87-0618,19/11/2019,54123-914,1,5.25,Polemoniaceae,est et tempus semper est quam pharetra magna ac consequat
Ofyyxz7qgh,2,5602233299615656,Prentice Codd,Stokes LLC,645-75-1953,2,796 Moose Parkway,Prentice,Codd,300-68-6734,30/12/2019,49371-045,1,14.2,Asteraceae,vivamus vel nulla eget eros elementum pellentesque quisque porta volutpat
K1AK51zhaY,4,5108752188775163,Bryon Spearman,Wiegand LLC,250-75-6985,1,529 Judy Point,Bryon,Spearman,488-86-8831,16/11/2019,52125-217,5,21.71,Cactaceae,sem mauris laoreet ut rhoncus aliquet pulvinar sed nisl
6dQZAu2qyS,3,3548448777961966,Dael Grelik,Armstrong-Quitzon,345-62-3301,3,56 Onsgard Point,Dael,Grelik,652-45-8349,20/06/2020,52125-154,4,14.89,Asteraceae,justo nec condimentum neque sapien
1lr39kjgNh,2,374288667995384,Lotti Carlsson,Ernser Inc,293-36-0403,4,915 Northview Plaza,Lotti,Carlsson,712-26-4674,18/04/2020,43861-1066,3,1.68,Fabaceae,neque aenean auctor gravida sem
v7tExDVe2L,3,6304565745654509113,Annabal Antrag,Osinski Inc,764-57-8385,3,18 Lunder Terrace,Annabal,Antrag,777-44-4293,06/06/2020,53645-1470,2,29.6,Asteraceae,ac leo pellentesque ultrices mattis odio
fiV62hhyPW,4,6333215856175632,Fairleigh Longhorn,Ortiz LLC,387-96-9206,3,866 Hudson Street,Fairleigh,Longhorn,253-95-3361,01/01/2020,0093-4029,3,16.84,Rubiaceae,integer pede justo lacinia eget
uSfyIlnxKw,2,3545257758778056,Reade Rucklidge,Carter-Balistreri,123-89-1480,4,90 Boyd Point,Reade,Rucklidge,409-39-3408,20/09/2019,52389-171,2,4.85,Bacidiaceae,curabitur in libero ut massa volutpat convallis morbi odio odio
iPrp1c6dDf,3,493648743544364698,Therese De Mico,Hilll- Wunsch and O'Conner,551-69-1608,4,9 Dahle Crossing,Therese,De Mico,414-26-5257,07/07/2020,50458-596,1,12.39,Brassicaceae,vestibulum rutrum rutrum neque aenean
jfNNLzt6V7,3,3581366252162884,Boniface MacTrusty,Hoppe and Sons,589-30-8251,1,55884 Transport Street,Boniface,MacTrusty,344-37-2217,08/07/2020,58980-415,2,26.57,Scrophulariaceae,cum sociis natoque penatibus et magnis dis
l0urxJ3rtz,2,5108753121143766,Susie Najara,Kertzmann-Schuster,777-91-9954,2,928 Erie Street,Susie,Najara,507-95-8267,28/02/2020,55154-2051,5,3.31,Convolvulaceae,sagittis nam congue risus semper porta volutpat quam pede lobortis
fTw5Xt27eR,1,67636195347110297,Calley Matessian,Lockman Inc,518-95-8847,1,64920 Cascade Terrace,Calley,Matessian,533-19-6882,06/08/2020,76436-137,1,11.34,Verbenaceae,morbi a ipsum integer a nibh in quis justo maecenas
pAMvmYl8w2,4,201441629902043,Agatha Perez,Gutmann-Graham,743-47-1516,2,49 Holy Cross Lane,Agatha,Perez,451-83-1329,19/04/2020,30014-003,4,15.53,Asteraceae,mi sit amet lobortis sapien
GXnfgi3SbS,3,3531198663068017,Conny Mocquer,Schmidt-Streich,571-43-5704,1,94 Redwing Pass,Conny,Mocquer,757-73-3460,18/12/2019,36800-359,4,12.64,Scrophulariaceae,nisl duis ac nibh fusce lacus
eNGye7rtoo,1,6767744842855361675,Elaine Denne,Lesch-Sporer,388-25-3409,3,97 Springview Park,Elaine,Denne,853-67-8870,21/06/2020,16714-532,5,28.65,Poaceae,volutpat dui maecenas tristique est et tempus
pIzI7cyL8m,4,3551803770935645,Hildegaard Tivnan,Auer-Barton,304-86-6854,3,4 Transport Street,Hildegaard,Tivnan,739-89-7472,29/10/2019,49967-707,2,20.22,Caryophyllaceae,pellentesque ultrices mattis odio donec vitae nisi
asLI3IC051,1,3568894814580530,Nataniel Copin,Stark-Steuber,545-81-8414,1,14895 Maple Center,Nataniel,Copin,878-06-5990,18/04/2020,11822-6020,2,10.28,Sapotaceae,elit ac nulla sed vel enim sit amet nunc
CWwML700rD,1,3571049743920738,Rafaellle Morit,Raynor- Rippin and Roberts,298-77-1386,2,1 Texas Way,Rafaellle,Morit,222-54-8374,22/04/2020,51672-1297,3,7.21,Dryopteridaceae,etiam faucibus cursus urna ut tellus nulla ut erat id
rRHZDXFvWf,1,3587526662071280,Kenny Brendish,Heller-Thompson,770-13-4772,3,43427 Sheridan Circle,Kenny,Brendish,287-60-6303,27/09/2019,36800-211,2,6.24,Apiaceae,pellentesque viverra pede ac diam cras pellentesque volutpat dui
O1fKrrpfVT,3,493601910639812411,Cullie Hairsnape,Monahan-Hintz,626-94-0293,2,7280 Cambridge Trail,Cullie,Hairsnape,485-69-4944,04/12/2019,49288-0147,5,29.38,Urticaceae,aliquam augue quam sollicitudin vitae consectetuer eget rutrum
PXzA4Wd6eQ,4,372301777435431,Mariette Bootyman,Frami- Huels and Renner,639-52-6241,1,05 Basil Avenue,Mariette,Bootyman,455-92-1730,09/02/2020,0904-5887,5,26.1,Pteridaceae,eu nibh quisque id justo sit
uI9dF1hg1a,2,6304890484934116541,Angy McClinton,Greenholt-MacGyver,643-43-1165,3,9224 Forest Circle,Angy,McClinton,246-14-7447,19/08/2020,63940-335,4,27.56,Cactaceae,bibendum imperdiet nullam orci pede venenatis non sodales sed
BB5oQwTrvJ,2,4405051604846119,Cordey Paulsson,Emmerich-Abshire,862-67-0014,2,28510 Elgar Hill,Cordey,Paulsson,358-76-4312,12/09/2020,66715-9741,1,1.29,Caryophyllaceae,a nibh in quis justo maecenas rhoncus aliquam lacus
mqqrXabUsA,2,3546366524538808,Wilden Donner,Metz LLC,808-08-7760,4,8635 Montana Center,Wilden,Donner,328-01-6100,29/02/2020,41163-110,5,22.28,Asteraceae,consequat varius integer ac leo pellentesque ultrices mattis odio donec
QpJCb15MWX,3,3562014981556413,Bay Yglesias,Will-Mayer,489-01-7901,2,5 Buhler Parkway,Bay,Yglesias,450-32-2146,25/02/2020,57896-455,3,21.34,Betulaceae,leo odio porttitor id consequat in consequat ut nulla sed
UronwGNSmK,1,337941214013848,Thibaud Hubbins,Schultz-King,829-71-4438,3,8 Eastlawn Lane,Thibaud,Hubbins,566-94-9250,26/09/2019,0093-2047,1,5.53,Lecanoraceae,amet justo morbi ut odio cras mi pede
l9KPYyMAjo,1,4405437955964231,Debbie Cavanaugh,Keeling-Denesik,499-94-7818,4,69119 Manitowish Junction,Debbie,Cavanaugh,778-01-2081,08/05/2020,65044-0846,4,17.91,Polygonaceae,in tempor turpis nec euismod scelerisque
wu6aw4KYg0,3,3540356384657620,Casey Sheron,Block- Waters and Prohaska,475-69-7435,1,16200 Maple Pass,Casey,Sheron,117-88-7363,02/06/2020,0113-0962,5,6.71,Gentianaceae,massa donec dapibus duis at velit eu est
rf3n6FAYr7,4,30049724145603,Kristo Brigdale,Reichert Group,732-56-1505,4,657 Elmside Drive,Kristo,Brigdale,648-96-1596,05/10/2019,0591-0795,3,20.17,Asteraceae,volutpat erat quisque erat eros viverra eget
bwQ3s914lb,4,374283812320547,Von Tibbetts,McClure Group,101-61-9109,3,72436 Graceland Avenue,Von,Tibbetts,484-75-2543,25/01/2020,49348-208,1,20.72,Brassicaceae,augue luctus tincidunt nulla mollis molestie lorem quisque ut erat
d17iiBxW9u,2,6333647577600217728,Stefano Ubanks,Langosh-Grant,551-03-0081,2,3 South Way,Stefano,Ubanks,896-63-9178,20/07/2020,54458-968,5,12.16,Poaceae,cras pellentesque volutpat dui maecenas
LmYPNJ6BE8,2,5602231176825609032,Charin Dorrian,Bednar- Kilback and Gottlieb,618-91-8329,1,3549 Westend Lane,Charin,Dorrian,308-53-3022,30/10/2019,55670-150,4,23.83,Piperaceae,pede ullamcorper augue a suscipit nulla elit ac
4CqPMm39ne,2,377484941427842,Cynde Brockton,Bosco- Walker and Bins,367-03-0345,1,68 Park Meadow Road,Cynde,Brockton,649-89-1882,27/01/2020,42903-002,1,4.12,Solanaceae,aliquam quis turpis eget elit sodales scelerisque
GVZoiKVEgD,4,67610787028916776,Nadiya Mandrake,Hettinger-Pacocha,562-70-7036,4,271 Parkside Park,Nadiya,Mandrake,357-58-1155,01/06/2020,0904-6271,2,16.58,Cyperaceae,platea dictumst etiam faucibus cursus urna ut tellus
6oituPqoJ6,2,5641827524472842,Vivyanne Mowday,Leffler- Auer and Vandervort,505-76-5008,3,82149 Sullivan Avenue,Vivyanne,Mowday,817-52-0291,11/05/2020,51079-499,1,23.25,Grimmiaceae,luctus nec molestie sed justo pellentesque viverra pede ac
hLGO2LkKKA,2,502018085782806356,Libbie Harrald,Rolfson- Mueller and Dibbert,708-02-8776,3,8911 School Terrace,Libbie,Harrald,470-35-4030,13/03/2020,49035-721,3,7.13,Flacourtiaceae,nam dui proin leo odio porttitor id consequat in
1RDurGcziC,2,201976706040878,Andriette Chittim,Wehner Group,775-24-8191,4,87 Kipling Street,Andriette,Chittim,373-05-5480,20/07/2020,35356-950,4,16.35,Malvaceae,sed accumsan felis ut at dolor quis odio consequat varius
XwmPEHevSG,1,3564696682505323,Pedro Rockwill,Gleason LLC,837-37-2359,4,286 Manufacturers Parkway,Pedro,Rockwill,444-25-9446,15/01/2020,59115-093,5,15.54,Fabaceae,in est risus auctor sed tristique in tempus sit amet
sNzSNaCtGv,1,3545567445880119,Isacco Cogdon,Graham and Sons,352-67-1512,3,5800 Kinsman Parkway,Isacco,Cogdon,391-41-9561,14/09/2020,0280-0225,1,1.48,Scrophulariaceae,vivamus tortor duis mattis egestas metus aenean fermentum donec ut
oABL2VLLeU,3,4026012643068445,Zackariah Kadwallider,Conn-Gulgowski,181-58-3639,2,551 Waubesa Terrace,Zackariah,Kadwallider,886-78-7549,22/12/2019,45861-017,5,26.16,Onagraceae,penatibus et magnis dis parturient montes nascetur ridiculus
kwwVtohQub,2,3549441808513582,Albina Eley,Collins-Collins,722-02-3744,4,405 Ilene Parkway,Albina,Eley,719-52-3066,21/10/2019,68745-1025,4,28.49,Asteraceae,pede justo eu massa donec dapibus duis
QfSIv85vMq,1,4041599289378,Morgan Nulty,Pagac-Huels,351-50-3621,1,79290 Holy Cross Way,Morgan,Nulty,807-88-2904,05/11/2019,58468-0070,1,28.35,Rubiaceae,erat tortor sollicitudin mi sit amet
9IV3jJynCb,4,5602246755142325076,Stinky Wenzel,Ankunding- Marvin and Nitzsche,138-01-1665,2,246 Bellgrove Trail,Stinky,Wenzel,588-66-4652,29/06/2020,42806-039,1,27.26,Rosaceae,eget massa tempor convallis nulla neque libero convallis
k0oWuPKu3O,2,0604568454519837563,Darwin Niaves,Schiller LLC,776-55-7920,1,61 Westerfield Hill,Darwin,Niaves,470-92-2867,19/07/2020,41520-865,2,21.68,Asteraceae,viverra eget congue eget semper
cpuXC86Hyo,2,201487158479564,Erny Pietrowicz,Krajcik- Davis and Hyatt,318-79-7716,4,70 Anthes Drive,Erny,Pietrowicz,280-43-4094,24/02/2020,62135-985,5,22.33,Pinaceae,ut ultrices vel augue vestibulum ante ipsum primis
qZcHQW45t2,2,50384406291741650,Arte Gookes,Reinger-Gerhold,878-35-4376,2,71298 Melby Center,Arte,Gookes,523-54-9442,05/07/2020,43269-829,5,10.14,Fagaceae,tincidunt nulla mollis molestie lorem quisque ut
ZFetvWeW8v,1,58938510047946101,Rahal Bugg,Batz-Herman,732-21-0298,4,8782 Bobwhite Park,Rahal,Bugg,314-58-7547,09/06/2020,58892-347,2,5.67,Salicaceae,tempus semper est quam pharetra
icNUvJrmqF,3,36200567214915,Leon Lawlor,Fisher- Schimmel and Gulgowski,356-74-1864,3,892 Armistice Lane,Leon,Lawlor,680-28-0349,12/12/2019,68516-3203,2,26.16,Myrsinaceae,sed nisl nunc rhoncus dui vel
fI3XfPyISR,2,3568457428946966,Abra Hendonson,Hammes Inc,187-47-0174,1,470 Oxford Circle,Abra,Hendonson,512-49-2897,03/08/2020,0603-5915,4,22.97,Asteraceae,nulla pede ullamcorper augue a
YvG2idXvGs,2,3534972135028727,Janice Crispe,Fay LLC,502-76-4733,1,34 Independence Hill,Janice,Crispe,324-38-7262,11/01/2020,59640-016,4,29.27,Convolvulaceae,quis orci nullam molestie nibh
6wPPz0gSWi,4,3531353484889972,Zachery Crab,Sanford- Gusikowski and Leannon,294-15-8132,2,0426 1st Pass,Zachery,Crab,652-83-3067,05/05/2020,68788-9069,4,28.56,Polygonaceae,mattis egestas metus aenean fermentum
JLXHioqFdU,4,4041595819737430,Carole Sperski,Stracke Group,440-74-1752,2,03 Rigney Street,Carole,Sperski,262-33-0493,31/08/2020,53489-517,4,19.28,Fabaceae,libero convallis eget eleifend luctus ultricies eu nibh
gzHCTBjmJa,1,6759808643687406096,Knox Yurkiewicz,Pfannerstill- Blick and Dare,238-86-0606,1,5452 Kedzie Court,Knox,Yurkiewicz,515-43-5239,20/05/2020,60432-275,1,6.03,Anacardiaceae,sed sagittis nam congue risus semper porta
4UymWixS5m,2,3589000854198572,Pierce Kinson,Bartoletti-Lesch,138-03-2811,1,76247 Arapahoe Hill,Pierce,Kinson,799-92-9947,02/05/2020,0615-1387,3,28.92,Chenopodiaceae,lobortis ligula sit amet eleifend
eILotnpFvd,2,3538430923865996,Hope Alliband,Kiehn- Bashirian and Smitham,488-29-5867,1,23 Redwing Point,Hope,Alliband,406-06-6547,12/11/2019,57520-0495,1,22.69,Uncertain Ascomycota Family,non quam nec dui luctus rutrum nulla
LWtQcvyuxj,4,4903576662219665,Rudy Elnaugh,Bednar-Shanahan,420-27-3254,4,58724 Barby Street,Rudy,Elnaugh,600-01-6297,16/04/2020,13537-494,5,25.59,Campanulaceae,rutrum rutrum neque aenean auctor gravida sem praesent
q9NR48YIcm,1,374288482012084,Kinsley Rastrick,Dach Group,275-06-5153,4,46 Myrtle Junction,Kinsley,Rastrick,667-92-7669,11/10/2019,68516-3603,1,16.06,Portulacaceae,montes nascetur ridiculus mus etiam vel augue
u2frsDivoh,1,3540278480670440,Gasparo Herkess,Jacobi- Christiansen and Pfeffer,136-03-7216,2,86118 Del Sol Parkway,Gasparo,Herkess,171-84-2768,21/10/2019,0310-0951,5,21.65,Cuscutaceae,montes nascetur ridiculus mus vivamus vestibulum sagittis sapien
zwo9OyR4qg,4,5602249118643968,Abbe Butland,Beatty- Shields and Leuschke,836-37-2057,4,84 Warner Center,Abbe,Butland,139-96-3017,09/02/2020,53808-0233,3,26.91,Fabaceae,curabitur gravida nisi at nibh in hac habitasse platea dictumst
6ivJ04Mx4G,4,5428214254801418,Kleon Leadbeatter,Wisoky- Brekke and Herman,572-13-6990,4,4615 Petterle Alley,Kleon,Leadbeatter,250-51-4587,09/04/2020,14783-886,5,8.95,Poaceae,amet lobortis sapien sapien non mi
4pBrnZTB3D,3,50204344171259162,Sherlocke Crichmere,Wiegand-Bartell,719-66-3252,4,68546 Delaware Way,Sherlocke,Crichmere,325-10-6664,02/09/2020,76439-207,3,9.18,Poaceae,orci vehicula condimentum curabitur in
GQSa8c7JVK,3,201973766677491,Viki Landsman,Oberbrunner- Douglas and Strosin,323-19-8117,2,4705 Columbus Parkway,Viki,Landsman,109-05-1256,17/02/2020,0268-6679,3,8.56,Caliciaceae,volutpat in congue etiam justo etiam
KIcTEdavDB,3,5389504712101014,Kristel Blamires,Carroll-Schamberger,460-62-7673,3,9389 Miller Place,Kristel,Blamires,173-47-2505,19/12/2019,51393-7655,5,13.23,Campanulaceae,vestibulum rutrum rutrum neque aenean auctor gravida sem praesent id
HeQ6I8N0JA,1,201676898636315,Sharyl Varney,Zulauf- Friesen and Herzog,469-61-0502,1,5866 Montana Alley,Sharyl,Varney,331-45-6362,24/06/2020,0904-6365,5,9.87,Papaveraceae,risus auctor sed tristique in tempus sit amet sem
rtDMtPHPdJ,3,5393247324071829,Jamill Brockie,Schaden- Mayert and Hills,408-68-2938,2,83382 Loeprich Pass,Jamill,Brockie,656-27-9473,12/01/2020,58118-1512,1,3.31,Cyperaceae,a ipsum integer a nibh in quis justo maecenas
nwdzXC2Twc,1,4936907097953724052,Maryl Melonby,Witting- Wilderman and Nikolaus,555-63-5963,2,4 Logan Avenue,Maryl,Melonby,562-92-8633,23/05/2020,55312-884,1,6.52,Asteraceae,pellentesque ultrices phasellus id sapien
kCRB3Rplg5,1,4905402308399943403,Axel Glason,Abernathy-McCullough,146-54-0871,1,8 Spaight Crossing,Axel,Glason,788-94-7955,26/08/2020,62011-0133,3,26.95,Zygophyllaceae,erat quisque erat eros viverra eget
xFvlitwYXf,3,3550535478850806,Andris Stapells,Casper-Murray,692-61-7161,4,1 Golden Leaf Street,Andris,Stapells,794-46-8752,31/08/2020,0904-7891,5,7.5,Ericaceae,interdum mauris non ligula pellentesque ultrices
7pzFrHYgXp,3,3534787056834741,Martin Roseveare,Johnson Group,831-10-1373,4,10 Summerview Avenue,Martin,Roseveare,512-38-9701,19/03/2020,62756-142,4,28.06,Haloragaceae,pulvinar sed nisl nunc rhoncus dui
paj3CSXzxU,3,3549036081690923,Erma Logg,Stoltenberg-Block,743-20-2232,1,09263 Calypso Plaza,Erma,Logg,164-66-9633,15/07/2020,42507-405,1,22.47,Nyctaginaceae,ullamcorper purus sit amet nulla quisque arcu libero rutrum ac
s76r21wiYI,1,3579756838583054,Sebastian Giannassi,Sipes Group,396-79-9725,2,4312 Stoughton Terrace,Sebastian,Giannassi,422-35-7365,19/03/2020,55648-903,1,17.73,Orchidaceae,nec molestie sed justo pellentesque viverra pede
mpFMvDN7gC,4,6333004225719784298,Gnni Toma,Rodriguez- Jakubowski and Stehr,511-71-1738,1,47 Elka Alley,Gnni,Toma,723-57-4690,11/04/2020,10096-0234,5,24.35,Euphorbiaceae,ullamcorper augue a suscipit nulla elit ac nulla sed
HIxMdZ02ap,3,201581279912642,Padriac Murrey,Schulist LLC,755-33-0797,2,8 Karstens Road,Padriac,Murrey,558-67-0723,23/03/2020,64980-140,1,18.83,Asteraceae,ac leo pellentesque ultrices mattis odio
6lUNSPZo5f,3,3549026534358129,Husein Peltz,Feeney- Wiza and Padberg,273-93-2161,2,6213 Jenna Junction,Husein,Peltz,867-28-7878,01/06/2020,67457-189,2,16.21,Apiaceae,posuere cubilia curae donec pharetra magna
