hTHHcQ7Dqb,2,30083072787864,Peggy Edmonson,Casper- Wunsch and Dickinson,421-80-5050,3,870 Eastlawn Place,Peggy,Edmonson,761-15-7579,27/07/2020,0378-0437,5,14.23,Verrucariaceae,lobortis convallis tortor risus dapibus
WEDINETTxS,3,201418744397432,Doralynne Cumbers,Altenwerth- Beier and Schaefer,693-62-2695,3,4877 Nancy Park,Doralynne,Cumbers,210-87-2534,09/08/2020,53329-087,3,12.36,Poaceae,lectus aliquam sit amet diam in
ZK49ivulkm,4,3542250170253157,Cara Eldred,Conn Inc,530-04-9435,4,8 Stoughton Court,Cara,Eldred,337-52-8679,01/10/2019,10216-3081,2,23.26,Liliaceae,eget rutrum at lorem integer tincidunt
YzNiYYDOQ2,3,3548193079316283,Berkley Waugh,Murphy Group,674-35-4899,3,8 Northfield Plaza,Berkley,Waugh,133-83-8496,28/12/2019,63323-127,3,20.63,Apocynaceae,vestibulum ante ipsum primis in faucibus orci luctus et ultrices
M2dtx2BpXO,4,3541216051437327,Shane Matelaitis,Heller- Sawayn and McCullough,382-47-0002,3,6269 Mayfield Court,Shane,Matelaitis,340-63-4418,26/06/2020,0093-7303,4,4.19,Lythraceae,molestie hendrerit at vulputate vitae nisl
XfAzl1yj71,3,5048372342235302,Jorge Kesey,Cole-Mante,772-75-0403,1,17 Marcy Plaza,Jorge,Kesey,644-49-2789,19/06/2020,52125-484,2,26.93,Apiaceae,at vulputate vitae nisl aenean lectus pellentesque eget
UJC2uFrZMB,2,675993991754788113,Afton Purbrick,Welch- Koelpin and Rowe,220-34-9000,1,059 Erie Road,Afton,Purbrick,736-79-4527,29/12/2019,10424-165,1,7.64,Liliaceae,nulla tempus vivamus in felis eu sapien cursus vestibulum proin
cpmDI37mDD,3,6759716411741755,Sven Vellacott,Glover- Ullrich and Conroy,315-13-6393,1,85 South Avenue,Sven,Vellacott,871-20-0424,26/08/2020,51138-065,5,25.15,Asteraceae,ipsum primis in faucibus orci luctus et ultrices
3iw3fHUzRl,1,372301222996813,Nikolaos Sowrah,Goyette-Rohan,113-76-4490,4,77268 Moulton Drive,Nikolaos,Sowrah,302-94-5112,16/01/2020,55648-773,1,22.96,Capparaceae,vel enim sit amet nunc viverra
D831RprJUh,1,3557134896014436,Iona Mallender,Lemke-Kihn,155-52-6242,4,20 Redwing Center,Iona,Mallender,865-76-1345,25/07/2020,0603-0852,1,20.65,Lecideaceae,elementum eu interdum eu tincidunt
9cOPu2KMsE,3,3588856781553853,Jerrilyn Sprade,Carroll- Gusikowski and Gleason,460-84-8211,4,84177 Mallory Road,Jerrilyn,Sprade,382-41-2789,11/03/2020,10889-202,4,13.46,Asteraceae,nunc proin at turpis a pede
kUVEWXngOZ,2,6333803771382886,Keelby Filppetti,Ortiz- Waelchi and Gaylord,138-31-6037,2,04494 Norway Maple Point,Keelby,Filppetti,387-08-6477,22/12/2019,62699-1112,4,17.3,Hymeneliaceae,ultrices posuere cubilia curae nulla dapibus dolor vel est
Wxa3CSxFyq,2,3586516233960609,Suzanna Rankine,Gerlach-Conn,105-16-7668,4,5 Bluejay Place,Suzanna,Rankine,479-44-5070,25/11/2019,36987-2069,3,11.83,Euphorbiaceae,aliquam quis turpis eget elit sodales scelerisque mauris sit
v4PvmLkOlo,2,4936097190335833,Nathalia Claige,Hilll-Bins,652-68-4828,4,8499 Logan Crossing,Nathalia,Claige,433-44-5128,16/05/2020,0603-9063,2,15.94,Poaceae,luctus ultricies eu nibh quisque id justo
S9u6pbSsiL,1,3572710405615515,Gaelan Fawson,Hintz- Blick and Hettinger,333-33-4468,2,2 Dahle Drive,Gaelan,Fawson,620-88-8384,19/10/2019,60505-0223,1,3.02,Asteraceae,magna ac consequat metus sapien ut nunc vestibulum ante ipsum
57a7FvcXXn,1,6767936016331600,Collie Sommerfeld,Schoen-Ryan,507-14-1405,2,30 Vera Court,Collie,Sommerfeld,143-95-1400,07/05/2020,57520-0069,2,17.99,Myrtaceae,tellus in sagittis dui vel nisl duis
gaZUnPxIvc,1,5576385819327774,Wally Mynett,DuBuque Group,246-82-1873,1,0729 4th Terrace,Wally,Mynett,593-05-0130,11/11/2019,51346-045,4,29.01,Liliaceae,magna at nunc commodo placerat praesent blandit
FpGxNkZCzl,3,5100170063632821,Saundra Farron,Klocko LLC,569-20-6558,1,9214 Shopko Junction,Saundra,Farron,241-05-6574,06/01/2020,57520-0414,1,6.9,Onagraceae,suscipit ligula in lacus curabitur at ipsum ac tellus
GT13XIbgBf,4,4175003519710086,Reeta Lavers,Botsford-Adams,561-13-6549,4,42455 Superior Park,Reeta,Lavers,228-29-1439,18/03/2020,0179-8704,2,15.07,Asteraceae,consequat ut nulla sed accumsan felis ut
q0o5o7st2A,4,3532534508436127,Ladonna Simoni,Gulgowski- Kassulke and Smitham,831-67-1780,3,2346 American Hill,Ladonna,Simoni,471-18-9119,01/12/2019,49999-632,1,28.31,Liliaceae,pede libero quis orci nullam molestie nibh in
RDenG4ThTB,2,5489330148315195,Giles Jean,Luettgen and Sons,482-05-7335,2,2 Melody Place,Giles,Jean,102-55-9141,02/06/2020,43498-150,2,10.27,Dicranaceae,quam pharetra magna ac consequat metus sapien
8rPXiCSLet,4,6761868728673332,Munroe Collman,Bashirian- Kovacek and Streich,141-97-9124,2,241 Montana Alley,Munroe,Collman,637-10-7568,02/05/2020,43353-924,3,12.3,Cyperaceae,vitae nisl aenean lectus pellentesque eget
XZ597x7lWo,1,3564163381136355,Leonelle Madgwich,Cole and Sons,554-23-4675,4,29 Granby Trail,Leonelle,Madgwich,448-81-4035,04/10/2019,50988-231,4,27.54,Loasaceae,nisi vulputate nonummy maecenas tincidunt lacus at
UH1dqzq2OC,3,3530762464479912,Darb Burhill,Abernathy-Bartoletti,237-89-8078,2,3 Green Lane,Darb,Burhill,187-29-2771,27/02/2020,65044-3078,2,26.87,Ericaceae,aenean auctor gravida sem praesent id
Lj60NUNapN,1,5100144266707896,Jefferson Lefley,Shields Inc,335-77-7407,3,446 Sauthoff Hill,Jefferson,Lefley,667-69-8082,28/12/2019,54868-5625,4,21.91,Sematophyllaceae,justo maecenas rhoncus aliquam lacus morbi
CDcnFyTovs,1,3557520441878749,Dionis Lean,Casper-Tremblay,808-89-0428,1,82 Bashford Parkway,Dionis,Lean,621-99-8822,11/01/2020,52125-365,2,28.69,Ericaceae,vel pede morbi porttitor lorem
2Zj9rZZo1b,2,633110954790740503,Kipper Ryrie,Heathcote-Mitchell,379-16-1927,1,2680 Texas Point,Kipper,Ryrie,445-82-6602,06/08/2020,68084-061,2,9.61,Typhaceae,vel est donec odio justo
GMeOL92008,2,676327830042157928,Gypsy Devanney,Ebert- Borer and Koelpin,224-79-7169,3,48 Gateway Alley,Gypsy,Devanney,824-56-0369,10/05/2020,64679-983,1,4.25,Moraceae,id mauris vulputate elementum nullam varius nulla facilisi cras non
F5VdYPEP9s,3,6331107771540283,Lucretia Ashwood,Cruickshank- Runolfsson and Hand,478-99-9791,4,396 Westerfield Court,Lucretia,Ashwood,252-38-9467,11/04/2020,31722-500,4,16.82,Fabaceae,quisque ut erat curabitur gravida nisi at nibh
2oehb4OUhF,4,63041313011690225,Benedikt Pawlicki,Marvin- Ernser and Fahey,428-69-8642,2,81736 Talmadge Road,Benedikt,Pawlicki,531-13-2633,31/10/2019,57483-003,4,8.27,Juncaceae,nullam orci pede venenatis non
1VwjUq6uJm,2,5602242609273916,Lind Stittle,Kessler-Nicolas,361-05-5955,4,56761 Moose Plaza,Lind,Stittle,681-51-8022,10/12/2019,0713-0324,5,10.63,Poaceae,sed ante vivamus tortor duis
bIRuL78Nj3,3,30128580190257,Raoul Meineck,Wilderman Group,671-16-2297,2,07599 Hanover Place,Raoul,Meineck,548-21-5628,07/01/2020,64942-1222,5,21.68,Pyrenulaceae,adipiscing lorem vitae mattis nibh ligula nec sem duis aliquam
1up7PAFd2H,4,201471507767499,Cherey Anan,Deckow- Lockman and Carter,695-33-7588,2,55 Lakewood Gardens Trail,Cherey,Anan,408-49-6117,24/11/2019,52271-158,3,11.66,Annonaceae,egestas metus aenean fermentum donec ut mauris eget
nDkjOosM6N,2,3583417485423102,Tamara Keating,O'Reilly-Purdy,325-27-4873,2,14739 Park Meadow Alley,Tamara,Keating,773-62-0063,16/12/2019,24385-461,2,22.21,Verrucariaceae,posuere cubilia curae donec pharetra magna vestibulum aliquet ultrices erat
EpmrnmW6Zn,2,6331108055996137236,Darby Yggo,Turner Inc,287-66-1953,3,58 Memorial Avenue,Darby,Yggo,684-92-1391,03/08/2020,36987-1107,2,29.53,Dryopteridaceae,nisi vulputate nonummy maecenas tincidunt lacus at velit vivamus
p1RicnImpu,2,3585561402140659,Alisha Tew,Armstrong-Keebler,394-73-4794,1,82 Morningstar Place,Alisha,Tew,247-37-2688,10/11/2019,60681-5303,3,12.46,Thelotremataceae,nulla sed accumsan felis ut at dolor quis
CJwZqXceTH,2,493690657165553305,Skyler Goldstraw,Schulist- Weissnat and Wiza,263-17-4433,1,87 Crownhardt Terrace,Skyler,Goldstraw,262-01-0305,31/08/2020,58142-7115,4,19.78,Portulacaceae,pharetra magna ac consequat metus
gwcQ5BoQ37,1,5100177549519837,Jenica Carnall,O'Keefe-Mohr,302-92-5824,2,726 Shasta Center,Jenica,Carnall,453-70-1552,12/03/2020,68001-004,3,16.21,Lamiaceae,varius integer ac leo pellentesque ultrices mattis
9dWJQLZQi4,4,6397564848516749,Arlee Kleisle,Dare- Greenholt and Cormier,698-05-2257,4,9 Tony Avenue,Arlee,Kleisle,697-61-5757,28/11/2019,63323-497,5,18.68,Asteraceae,rhoncus aliquam lacus morbi quis tortor id
IC1445BG7U,3,3571105260247473,Ron Addyman,Gutkowski- Douglas and Larkin,303-64-2634,4,03399 Fulton Center,Ron,Addyman,586-17-2001,03/07/2020,13733-060,4,27.1,Asteraceae,volutpat quam pede lobortis ligula sit amet
Qb93LmY6g3,4,3564582927266923,Bendicty Verrills,Kuphal- Hickle and Runolfsdottir,425-13-8228,1,67 Hintze Point,Bendicty,Verrills,277-30-2228,16/08/2020,52125-537,3,27.64,Isoetaceae,eu sapien cursus vestibulum proin eu mi nulla ac
3J92JY6eQ1,4,6762733224833211,Cori Bosche,Aufderhar- McCullough and Gulgowski,451-38-2818,4,46625 Nelson Trail,Cori,Bosche,116-40-2302,11/12/2019,0093-7436,3,27.77,Cactaceae,justo in blandit ultrices enim lorem ipsum dolor sit amet
Rk4EabytU4,2,3532224481517818,Raffaello Oran,Gerhold Inc,796-29-0999,4,46674 Huxley Junction,Raffaello,Oran,279-03-8185,11/04/2020,51393-7433,2,1.46,Fabaceae,aliquet at feugiat non pretium quis
r9chVvhrhJ,4,5100144944195753,Coralyn Brinkman,Hodkiewicz-Bosco,734-94-2940,4,38 Mesta Road,Coralyn,Brinkman,845-71-4478,03/08/2020,51079-889,2,16.62,Lamiaceae,fringilla rhoncus mauris enim leo rhoncus sed vestibulum
edzC1MHvJD,2,5610752695701976,Galvin Doog,Altenwerth Inc,310-59-7825,3,2164 Banding Crossing,Galvin,Doog,191-87-5155,24/03/2020,55154-2661,1,9.29,Asteraceae,mus etiam vel augue vestibulum rutrum rutrum neque
Ul4fOwRkb9,1,3560693696607215,Logan Malkin,Bins- Konopelski and Schaden,502-42-9054,4,79 Ilene Crossing,Logan,Malkin,181-14-6219,30/07/2020,49288-0656,1,26.66,Euphorbiaceae,ipsum primis in faucibus orci
lkc1E9kEGG,1,3582815178174299,Albert Harkess,Stoltenberg- Quitzon and Lubowitz,478-22-1621,4,4884 Stang Park,Albert,Harkess,688-78-8810,12/11/2019,43547-279,2,22.32,Orchidaceae,quam pharetra magna ac consequat metus sapien ut nunc vestibulum
Lz6HSdwFc7,2,5048372666885575,Arleyne Bream,White-Reinger,345-79-1090,2,247 Dahle Parkway,Arleyne,Bream,502-35-9514,01/06/2020,57472-001,3,27.47,Haloragaceae,eget vulputate ut ultrices vel augue vestibulum ante ipsum
1zEmMViGh9,4,3583876460854344,Kim Pauwel,Thiel and Sons,696-36-4166,4,50 Sutteridge Park,Kim,Pauwel,604-35-7236,09/03/2020,52125-668,1,25.76,Asteraceae,ridiculus mus vivamus vestibulum sagittis sapien cum sociis natoque penatibus
pOy39I75Bh,2,4026454224354911,Fabiano Leddy,Renner Inc,193-22-1990,3,93 Stoughton Center,Fabiano,Leddy,427-51-9523,05/05/2020,0781-5284,5,23.93,Trapeliaceae,amet nulla quisque arcu libero rutrum ac
TiMl8mhgS5,4,3576166448750510,Celle Keys,Hudson-Kub,579-59-4712,1,96352 Pankratz Crossing,Celle,Keys,448-41-1687,31/12/2019,43742-0237,4,1.16,Juncaceae,potenti in eleifend quam a
Hel8BmxrXw,2,3585184721772381,Hedwig MacAndie,McCullough-Mayert,615-47-6294,4,27170 Arapahoe Alley,Hedwig,MacAndie,541-19-3093,27/04/2020,59779-388,2,17.42,Caryophyllaceae,nec nisi vulputate nonummy maecenas tincidunt lacus at
rQHULCuiHS,3,58930717154540274,Brade Davidou,Schmidt LLC,674-34-2795,1,512 Brentwood Plaza,Brade,Davidou,831-97-4220,06/11/2019,36987-1891,1,19.86,Fabaceae,pretium iaculis justo in hac habitasse platea
u7BEY6HO9B,4,5893904348679952849,Bevvy Headley,Stark Inc,215-94-0239,1,8480 Riverside Crossing,Bevvy,Headley,111-21-3427,13/12/2019,16729-124,3,24.37,Lycopodiaceae,quis augue luctus tincidunt nulla mollis molestie lorem quisque
qoP55MIL17,4,5133207479694119,Alasdair Sarrell,Sporer-Doyle,560-71-6854,2,8372 Drewry Place,Alasdair,Sarrell,520-17-9074,15/01/2020,61442-113,3,1.0,Poaceae,nam congue risus semper porta volutpat quam pede
5ymzMBncUT,3,3580117352962827,Faith Moston,Ortiz- Kovacek and Mraz,270-84-6270,1,12 Kings Center,Faith,Moston,274-61-1825,30/04/2020,43857-0242,5,12.86,Euphorbiaceae,vel pede morbi porttitor lorem
x2Gl3zZh5X,4,5100144874425204,Buddy Poland,Little-Farrell,259-84-8247,4,8956 Quincy Place,Buddy,Poland,587-36-5963,16/04/2020,35356-980,1,17.6,Solanaceae,in hac habitasse platea dictumst aliquam augue quam sollicitudin
bRe1ykpMiG,2,36488346285484,Hayyim Quinney,Hills-Lindgren,870-77-0153,2,51501 Loftsgordon Hill,Hayyim,Quinney,378-80-8266,28/04/2020,41167-1003,2,19.92,Solanaceae,imperdiet nullam orci pede venenatis
xJd9j1DaiE,3,4913684106257966,Carmelina Lygoe,Hodkiewicz-Waelchi,569-39-4702,3,0115 La Follette Alley,Carmelina,Lygoe,618-23-7856,30/06/2020,59417-105,1,7.61,Poaceae,quis lectus suspendisse potenti in eleifend quam
6ohbzcSRz2,2,67619613701359814,Candice Trimmell,West and Sons,121-87-2193,3,81 Tomscot Terrace,Candice,Trimmell,607-75-2197,08/04/2020,54569-1118,3,9.89,Malvaceae,sed sagittis nam congue risus semper porta volutpat quam pede
1NCU1UhI5w,2,5602221895807983,Willi Glennon,McGlynn-Pouros,628-53-2930,1,9131 Novick Way,Willi,Glennon,612-61-8981,03/01/2020,41520-517,4,13.94,Verrucariaceae,et ultrices posuere cubilia curae nulla dapibus dolor
B7L3K96q7Q,3,346600413219007,Arie Brabender,Grimes LLC,507-79-5071,1,76734 Hooker Trail,Arie,Brabender,710-73-3400,14/11/2019,0268-1159,2,21.07,Asteraceae,proin interdum mauris non ligula pellentesque ultrices phasellus
9ln2Igmylg,2,5602232252801246,Phyllis Ivanyukov,Nicolas LLC,176-74-8461,2,476 Mendota Drive,Phyllis,Ivanyukov,579-57-9800,16/07/2020,67544-247,4,7.35,Bryaceae,ligula pellentesque ultrices phasellus id sapien in sapien
U3Z66EmWVl,1,3573702031186994,Duke Wittman,Lind Inc,825-22-1780,1,6540 Dexter Pass,Duke,Wittman,531-98-1983,21/04/2020,0228-2539,3,26.82,Grimmiaceae,ac enim in tempor turpis nec euismod scelerisque quam turpis
B69JClGb7J,4,675937493074671003,Francyne Desforges,O'Hara- Heller and Leannon,595-89-8071,1,9 Menomonie Trail,Francyne,Desforges,779-72-0720,02/06/2020,60512-8030,3,10.57,Polygonaceae,amet turpis elementum ligula vehicula consequat
lloTyd5PO3,4,490580128949800692,Ronny Biddiss,Emard Inc,782-58-7837,2,0984 Nelson Junction,Ronny,Biddiss,459-64-7608,07/10/2019,0591-3499,1,21.2,Asteraceae,in faucibus orci luctus et
18XChzT4vp,3,6394798574942298,Vivyan Lowell,McCullough-Satterfield,663-78-1631,4,24376 Steensland Center,Vivyan,Lowell,552-63-9681,25/11/2019,48095-390,2,29.17,Asteraceae,vestibulum ante ipsum primis in faucibus orci luctus et
qWuSpkGc4t,3,372313426799158,Rollo Capoun,Crist- Roberts and Glover,191-92-2402,2,94 Oxford Hill,Rollo,Capoun,147-44-7349,19/03/2020,55154-2857,3,5.21,Acarosporaceae,penatibus et magnis dis parturient
OKjo8N7std,2,30118450166701,Casi Bartholomaus,Kutch-Schimmel,333-58-4320,1,4608 Mandrake Drive,Casi,Bartholomaus,828-64-2767,31/01/2020,0378-7351,5,25.11,Asteraceae,dictumst morbi vestibulum velit id pretium iaculis diam erat fermentum
PuGJwHPMps,1,560225857752496443,Gavra Gather,Goldner-Flatley,180-56-8288,2,46 Doe Crossing Point,Gavra,Gather,488-72-4592,15/06/2020,13537-534,2,16.65,Oleaceae,diam neque vestibulum eget vulputate ut ultrices
bciHpPtsDC,4,5602256316080224,Shay Mundle,Treutel Inc,801-48-4060,1,5 Helena Terrace,Shay,Mundle,820-93-0032,19/10/2019,58118-0002,5,24.95,Acanthaceae,non mauris morbi non lectus
ZcUZICPM2h,1,6767952612645988,Danna Breitling,Fay LLC,650-19-1240,2,4 Eastwood Plaza,Danna,Breitling,787-19-4884,30/07/2020,61328-006,4,10.48,Convolvulaceae,dictumst morbi vestibulum velit id pretium iaculis diam erat fermentum
6QC9N3EIPs,4,3552146471736535,Vicki O'Loughlin,Cole Group,879-63-5463,1,546 Ronald Regan Center,Vicki,O'Loughlin,435-24-4553,21/03/2020,63187-081,3,19.26,Asteraceae,commodo vulputate justo in blandit ultrices enim lorem
CfHaHI0SO2,2,503897813750325792,Duncan Biaggiotti,Jones-Spencer,676-78-7942,1,15 Monument Hill,Duncan,Biaggiotti,551-12-9094,10/11/2019,43611-003,2,4.81,Collemataceae,ut rhoncus aliquet pulvinar sed nisl nunc rhoncus dui
EGqPo5RYH5,3,3536176210904053,Bay Miskelly,Mayert-Klocko,513-83-0621,1,27406 Talmadge Road,Bay,Miskelly,618-31-3842,30/03/2020,36987-1388,2,26.22,Dicranaceae,turpis elementum ligula vehicula consequat morbi a ipsum
E5kMXGchCC,3,374283456463280,Bev Long,Green Group,738-53-0713,1,6 Lawn Street,Bev,Long,194-75-2291,19/04/2020,60258-520,3,26.46,Asteraceae,ut massa quis augue luctus tincidunt nulla mollis
1IebxQIdkD,1,3583202332023622,Nico Virgo,Hauck-Runte,269-59-5856,2,06 Anzinger Terrace,Nico,Virgo,166-15-1790,28/06/2020,49349-406,1,5.0,Dactylosporaceae,nulla mollis molestie lorem quisque ut
djWoBsuTEg,4,50209051919543535,Eydie Plaster,Armstrong- Medhurst and Hintz,549-20-5383,1,67028 Bunting Road,Eydie,Plaster,263-08-2629,24/01/2020,49035-112,2,25.2,Pteridaceae,amet diam in magna bibendum
ShAPF4Qxsp,3,3555522212991364,Alta Radborn,Romaguera-Schultz,588-59-1251,1,971 Florence Junction,Alta,Radborn,389-83-6212,06/09/2020,43749-110,5,11.35,Poaceae,porttitor pede justo eu massa donec dapibus
fJeA9wJX1i,3,5602246182361170,Nadya Jadczak,Dietrich and Sons,208-56-4453,2,90410 Dapin Court,Nadya,Jadczak,344-57-5961,17/02/2020,57520-0026,1,3.23,Scrophulariaceae,dui vel nisl duis ac nibh
GYEXt0IKeA,4,4508034603951037,Patric Gallemore,Price- Weimann and Crooks,751-07-7824,2,26 Sauthoff Alley,Patric,Gallemore,372-66-3598,25/11/2019,54868-1986,5,28.7,Scrophulariaceae,bibendum morbi non quam nec dui
673p1GqlvD,2,5602232915777667202,Colman Petracci,Kling LLC,876-30-3772,3,8304 Burning Wood Pass,Colman,Petracci,649-87-1842,06/05/2020,0781-5169,3,8.66,Brassicaceae,turpis adipiscing lorem vitae mattis nibh
DujBokiZB2,3,5010120253010659,Rachael McLese,King- Spencer and Oberbrunner,262-36-9940,4,28 Michigan Junction,Rachael,McLese,265-21-3891,24/07/2020,13537-310,1,19.02,Myrtaceae,lacus morbi sem mauris laoreet ut rhoncus aliquet pulvinar sed
At3ut0KHTu,4,3546238573593382,Raffarty Malyj,Braun-Welch,725-64-6902,3,898 3rd Parkway,Raffarty,Malyj,596-33-6531,30/10/2019,64117-144,4,9.19,Rosaceae,turpis nec euismod scelerisque quam turpis adipiscing
BBGCT1Fb3c,2,5602245931934113,Kamila Spalls,D'Amore-Murray,660-76-6342,1,4 Cordelia Place,Kamila,Spalls,883-13-0790,20/05/2020,58517-340,4,7.13,Hymenophyllaceae,nam nulla integer pede justo lacinia eget tincidunt eget tempus
3uLrVjyqdn,2,3560183562957795,Penrod Studdeard,Klocko-Gottlieb,809-85-3580,2,959 Gale Crossing,Penrod,Studdeard,778-91-4918,17/11/2019,0093-5246,5,2.03,Gesneriaceae,leo maecenas pulvinar lobortis est phasellus sit amet erat
b2mRLRPhr8,2,5100174218679075,Jon Legge,Fritsch- Boyer and Zemlak,870-12-5327,2,1 Waubesa Avenue,Jon,Legge,398-46-4368,27/07/2020,41250-309,2,9.41,Verbenaceae,lorem id ligula suspendisse ornare consequat lectus in est
y9VSYMDc4a,2,5280875384429986,Modestia Jesson,Jaskolski-Davis,226-40-5215,2,49 Jenna Lane,Modestia,Jesson,258-22-9218,13/05/2020,0338-3551,3,29.17,Bartramiaceae,sapien iaculis congue vivamus metus arcu
34NQ1SEjbN,2,3576822275191000,Miller Torpie,Walter- Klein and Smitham,607-22-2999,2,0 Norway Maple Center,Miller,Torpie,372-50-5591,27/08/2020,49288-0046,5,8.21,Lamiaceae,aenean auctor gravida sem praesent id
tIrN13ldw5,1,491157630758827709,Ciel Gerault,Lueilwitz- Crooks and Little,314-55-3606,3,4 Carberry Hill,Ciel,Gerault,198-58-5383,07/08/2020,61957-0111,2,1.82,Cuscutaceae,eu felis fusce posuere felis sed
FMZIVpgXM3,1,6763656988831072,Shirline Sedwick,Stark-Crist,408-33-0496,3,94 Dwight Street,Shirline,Sedwick,602-78-4783,21/07/2020,68084-725,3,7.04,Rubiaceae,ut mauris eget massa tempor convallis nulla neque libero convallis
Atj5xfv66o,2,6767321288472261495,Keeley Clabburn,Waelchi LLC,430-35-8947,2,55998 Summer Ridge Point,Keeley,Clabburn,887-57-9000,02/10/2019,55154-3727,1,9.02,Solanaceae,magna at nunc commodo placerat praesent blandit nam nulla integer
np8DUuRcgS,3,3564016270492679,Donnie Langlands,Hilpert and Sons,578-54-9359,1,3 Katie Plaza,Donnie,Langlands,535-69-0954,01/04/2020,63148-253,3,29.4,Commelinaceae,ultrices posuere cubilia curae mauris viverra
MFxCil81A1,3,5108753009104104,Charmine Summerlie,Block-Ritchie,532-10-1140,4,30 Red Cloud Crossing,Charmine,Summerlie,570-37-5395,07/02/2020,37808-431,3,2.62,Poaceae,ac enim in tempor turpis nec euismod scelerisque quam turpis
dA4QjmG8KF,4,5602221988366180435,Hildagard Bertholin,Jast- Schoen and Stark,553-51-0806,4,5772 Morrow Trail,Hildagard,Bertholin,268-34-4127,07/09/2020,52125-220,1,10.48,Rosaceae,eget semper rutrum nulla nunc purus phasellus
8v8AylEBLf,2,6398999003845815,Maurita Stickels,Stamm-Streich,274-48-7102,3,000 Brickson Park Plaza,Maurita,Stickels,856-52-3411,05/07/2020,23155-001,1,28.65,Cyperaceae,mollis molestie lorem quisque ut erat curabitur
UqIYWoZPMC,1,3552792234331708,Kassia Konzel,Schoen- Morar and Quitzon,526-35-9071,3,1 Shopko Trail,Kassia,Konzel,280-03-2218,06/05/2020,36987-2491,3,15.46,Verbenaceae,vestibulum rutrum rutrum neque aenean auctor gravida
OyaOBgm67F,1,3573909850473896,Grazia Tierny,Koss Inc,558-78-6475,3,134 Clyde Gallagher Way,Grazia,Tierny,365-98-2380,13/11/2019,49158-502,4,14.95,Scrophulariaceae,ante ipsum primis in faucibus
lEZjA98kZS,3,3529263138018031,Tudor Havard,Williamson- Schuppe and Treutel,217-94-2052,4,789 Jenifer Alley,Tudor,Havard,700-39-4623,11/02/2020,16590-437,2,18.17,Rosaceae,vivamus in felis eu sapien
uwBQvYbCZ3,1,676310552694169972,Mart Etuck,Dicki- Reichel and Spencer,784-84-0016,3,39 Scoville Hill,Mart,Etuck,836-59-3540,10/06/2020,10742-8458,4,6.09,Polypodiaceae,sem mauris laoreet ut rhoncus aliquet pulvinar
GcLCd8gEYc,4,4508053241393170,Cordelie Dodge,Swift Inc,584-27-6962,3,9348 Prairie Rose Circle,Cordelie,Dodge,231-50-8828,29/09/2019,0054-0259,2,14.1,Fagaceae,luctus et ultrices posuere cubilia curae mauris viverra diam
U9NlEDypHs,1,560221328581636546,Jenelle McIlmorow,Mills Inc,899-69-2847,3,1 Meadow Valley Crossing,Jenelle,McIlmorow,304-83-7283,04/07/2020,59630-630,3,23.1,Fabaceae,in leo maecenas pulvinar lobortis est phasellus sit
DFX6GI6Gfu,1,3547751324841172,Alfy Bengochea,Bahringer- Gottlieb and Dickinson,431-23-9292,4,51532 East Center,Alfy,Bengochea,472-46-8921,20/10/2019,55312-075,3,13.54,Asteraceae,turpis a pede posuere nonummy integer non
lTynk9WZhV,2,4175003187181651,Corbett Boskell,Koelpin- Nienow and Moore,168-45-6924,4,4617 Summit Court,Corbett,Boskell,650-10-1944,04/06/2020,36800-258,3,6.72,Asteraceae,nulla justo aliquam quis turpis eget
Kp9YiL6IMl,2,3568632510255506,Gwenneth Czaple,Donnelly LLC,757-39-2943,4,53066 Esker Place,Gwenneth,Czaple,756-55-7760,19/03/2020,58503-060,1,3.37,Asteraceae,tellus in sagittis dui vel nisl duis ac nibh
z99lNElqvY,3,3536953042153699,Wang Broker,Pagac Inc,646-59-5197,4,3 Homewood Point,Wang,Broker,886-29-6310,20/01/2020,0067-2091,2,29.58,Campanulaceae,pellentesque ultrices phasellus id sapien in sapien iaculis
BjWbsxDFEo,3,5602226151622695,Shaw Knightly,Abbott Inc,327-09-5875,3,3987 Clemons Plaza,Shaw,Knightly,882-99-2440,10/10/2019,51079-510,2,16.94,Hydrophyllaceae,nulla integer pede justo lacinia eget tincidunt
SJDzltb9eU,3,343905778324562,Ezmeralda Goodwin,Leffler LLC,420-09-1944,4,7 Oakridge Point,Ezmeralda,Goodwin,490-66-3700,18/12/2019,33992-0611,5,29.99,Apiaceae,volutpat quam pede lobortis ligula sit
KNex04oqpV,2,4913362931613139,Woodman Orchart,Runolfsson LLC,691-50-3578,3,806 Ruskin Street,Woodman,Orchart,887-55-2593,30/08/2020,0904-5895,4,28.32,Apiaceae,mattis nibh ligula nec sem duis aliquam convallis nunc proin
0TJgWRd99F,1,3543325438140278,Geralda Sullivan,Christiansen LLC,120-64-8010,3,3355 Brown Pass,Geralda,Sullivan,238-36-0509,01/04/2020,50114-7050,2,26.04,Fabaceae,quam fringilla rhoncus mauris enim leo rhoncus sed
jYFg8FsXDV,1,3547946709524696,Rex Cogdell,Schmeler- Cremin and Koepp,395-08-1989,1,4 Ruskin Trail,Rex,Cogdell,392-31-0244,23/07/2020,50436-3779,3,10.08,Lamiaceae,ultrices posuere cubilia curae mauris viverra
vGjy0PLh6s,2,3551266166642938,Leonanie Hawthorne,Stroman and Sons,587-21-0213,2,5216 Brown Plaza,Leonanie,Hawthorne,813-08-5917,03/07/2020,36987-2459,3,28.71,Pteridaceae,nullam sit amet turpis elementum ligula vehicula
JcPO3gQItm,4,3588589333107601,Drusie Antonnikov,Braun- Stokes and Bartell,829-65-2252,2,90 Florence Park,Drusie,Antonnikov,590-34-3835,20/07/2020,50580-100,3,18.11,Lamiaceae,nulla nisl nunc nisl duis bibendum felis sed
doGp69E9Wq,1,337941253459639,Alayne Ebbin,Kassulke-Mitchell,865-10-0582,2,03516 David Point,Alayne,Ebbin,416-46-7381,19/05/2020,43353-904,5,17.58,Cistaceae,pellentesque eget nunc donec quis orci eget orci vehicula
QA84R0VVYa,4,589349096383787520,Annadiane McGraffin,Kautzer- Bernhard and Blick,350-50-3739,3,14 Prairieview Park,Annadiane,McGraffin,253-21-2132,14/04/2020,54575-375,2,21.58,Arecaceae,nascetur ridiculus mus vivamus vestibulum
ieGu8pxofe,2,3546023662332235,Frasier Pipes,Tremblay- Roberts and Konopelski,552-82-4924,3,86 Main Way,Frasier,Pipes,782-10-1926,05/03/2020,33261-029,1,7.72,Asteraceae,in tempor turpis nec euismod
7627WRvhel,3,3537033143248463,Mal Ostrich,Terry- Krajcik and O'Kon,157-51-7597,2,4 Pleasure Lane,Mal,Ostrich,367-98-3426,08/01/2020,50730-1016,5,13.74,Rubiaceae,ultrices posuere cubilia curae mauris viverra
20j8zQa3sr,1,5048375037801684,Kellen Mishow,Parker-Muller,638-81-6637,2,9 Crest Line Alley,Kellen,Mishow,492-04-0067,24/09/2019,54868-5248,2,17.67,Poaceae,quis turpis eget elit sodales scelerisque mauris sit amet eros
6uQNs0bvHM,3,3556396324772924,Doe Ashwood,Reichel LLC,175-43-8973,2,85 Spaight Road,Doe,Ashwood,359-24-4165,12/08/2020,55118-400,3,15.79,Asteraceae,lacus at turpis donec posuere metus vitae ipsum
bwkdSZwJyo,2,3529530790285474,Warren Haslock,Kiehn-Lemke,526-91-5564,4,8551 Oneill Terrace,Warren,Haslock,770-07-6618,31/10/2019,60512-1022,4,3.41,Fabaceae,rutrum ac lobortis vel dapibus at
DlMquTIUGM,2,4903777559178820,Dominga Laborda,Runolfsson-Pacocha,199-95-5194,2,77489 Nancy Park,Dominga,Laborda,880-70-8423,03/12/2019,51393-6558,3,29.04,Capparaceae,eget elit sodales scelerisque mauris sit amet eros
dhkMPyDFhC,1,3546054638224552,Benedikta Maruszewski,Bashirian Group,169-81-4381,4,11 Pierstorff Center,Benedikta,Maruszewski,113-45-2235,15/05/2020,57237-054,1,26.96,Scrophulariaceae,iaculis congue vivamus metus arcu
